user_input,retrieved_contexts,response,reference,context_precision,faithfulness,answer_relevancy,context_recall,retrieval
¿Qué se entiende por cerveza?,"['Definir el objeto de muestreo\t¿Qué tipo de alimento se va a muestrear?', 'ACIÓN Y\nREGISTROS\tdurante el tiempo necesario en cada caso.', '11. MUESTREO.\nSe seguirán los procedimientos recomendados en la Norma FIL 50B: 1985.\nRESOLUCIÓN GMC N° 032/96\nIncorporada por Resolución MSyAS N° 435 del 26.06.97\nSe deroga toda legislación del Código Alimentario Argentino que se oponga al dictado de la\npresente Resolución\nREGLAMENTO TÉCNICO MERCOSUR DE IDENTIDAD Y CALIDAD DEL QUESO\nTILSIT\nArt 1° - Aprobar el Reglamento Técnico MERCOSUR de Identidad y Calidad del Queso Tilsit que\nfigura en el Anexo de la presente Resolución.\nArt 2° - Los Estados Partes pondrán en vigencia las disposiciones legislativas, reglamentarias y\nadministrativas necesarias para dar cumplimiento a la presente Resolución a través de los\nsiguientes organismos:\nArgentina: Ministerio de Salud y Acción Social; Ministerio de Economía y Obras y Servicios\nPúblicos; Secretaría de Agricultura, Pesca y Alimentación; (Servicio Nacional de Sanidad Animal)\nBrasil: Ministerio de Salud; Ministerio de Agricultura y de Abastecimiento\nParaguay: Ministerio de Salud Pública y Bienestar Social; Ministerio de Agricultura y Ganadería\nUruguay: Ministerio de Salud Pública; Ministerio de Industria, Energía y Minería; (Laboratorio\nTecnológico del Uruguay); Ministerio de Ganadería, Agricultura y Pesca\nArt 3° - La presente Resolución entrará en vigor en el Mercosur en un plazo máximo de 90\n(noventa) días a partir de su aprobación.\n1. ALCANCE\n1.1. Objetivo\nEstablecer la identidad y los requisitos mínimos de calidad que deberá cumplir el Queso Tilsit\ndestinado al consumo humano. El Queso Tilsit para uso industrial podrá no cumplir con todos los\nrequisitos de este reglamento siempre que para ello exista una justificación tecnológica.\n1.2. Ambito de Aplicación\nEl presente Reglamento se refiere al Queso Tilsit a ser comercializado en el MERCOSUR.\n2. DESCRIPCIÓN\n2.1. Definición\nCon el nombre de Queso Tilsit se entiende el queso madurado que se obtiene por coagulación de\nla leche por medio del cuajo y/u otras enzimas coagulantes apropiadas, complementada o no por\nla acción de bacterias lácticas especificas.\n2.2. Clasificación\nEl Queso Tilsit es un queso de mediana humedad y graso de acuerdo a la clasificación establecida\nen el ""Reglamento Técnico General MERCOSUR de Identidad y Calidad de Quesos"".\n2.3. Designación (Denominación de Venta).\nSe denominará ""Queso Tilsit"" o ""Queso Tilsit de Uso Industrial"" según corresponda.\n3. REFERENCIAS\nReglamento Técnico General MERCOSUR para la Fijación de Requisitos Microbiológicos de\nQuesos.\nReglamento Técnico General MERCOSUR de Identidad y Calidad de Quesos.\nNorma FIL 4A:1982. Quesos y Quesos procesados. Determinación del contenido de sólidos totales\n(Método de referencia).\nNorma FIL 5B:1986. Quesos y Productos Procesados de Queso. Contenido de Materia Grasa.\nNorma FIL 5OB:1985. Leche y productos lácteos-Métodos de muestreo.\nNorma A6 del Codex Alimentarius. Norma General para el Queso.\nNorma FIL 99A:1987. Evaluación sensorial de Productos Lácteos.\n4. COMPOSlClÓN Y REQUISITOS\n4.1. Composición\n4.1.1. Ingredientes obligatorios.', 'Sin perjuicio de los establecido en el presente Reglamento, los Reglamentos Técnicos Individuales\npodrán contener disposiciones que sean más específicas y, en tales casos, aquellas disposiciones\nmás específicas se aplicarán a la variedad individual o a los grupos de variedades de quesos.\n2. Descripción\n2.1. Definición\nSe entiende por Queso el producto fresco o madurado que se obtiene por separación parcial del\nsuero de la leche o leche reconstituida (entera, parcial o totalmente descremada), o de sueros\nlácteos, coagulados por la acción física, del cuajo, de enzimas específicas, de bacterias\nespecíficas, de ácidos orgánicos, solos o combinados, todos de calidad apta para uso alimentario;\ncon o sin el agregado de sustancias alimenticias y/o especias y/o condimentos, aditivos\nespecíficamente indicados, sustancias aromatizantes y materiales colorantes.\nSe entiende por Queso Fresco el que está listo para el consumo poco después de su fabricación.\nSe entiende por queso madurado el que ha experimentado los cambios bioquímicos y físicos\nnecesarios y característicos de la variedad de queso.\nLa denominación QUESO está reservada a los productos en que la base láctea no contenga grasa\ny/o proteínas de origen no lácteo.\n2.2 - Clasificación\nLa siguiente clasificación se aplicará a todos los quesos y no impide el establecimiento de\ndenominaciones y requisitos más específicos, característicos de cada variedad de queso que\naparecerán en los Reglamentos Técnicos Individuales.\n2.2.1 De acuerdo al contenido de materia grasa del extracto seco, en porcentaje, los quesos se\nclasifican en:\nExtra Graso o Doble Crema: cuando contengan no menos del 60 %\nGrasos: cuando contengan entre 45,0 y 59,9 %\nSemigrasos: cuando contengan entre 25,0 y 44,9 %\nMagros: cuando contengan entre 10,0 y 24,9 %\nDescremados: cuando contengan menos de 10,0 %\n2.2.2 De acuerdo al contenido de humedad, en porcentaje, los quesos se clasifican en:\nQuesos de baja humedad (generalmente conocidos como de pasta dura): humedad hasta 35,9\n%\nQuesos de mediana humedad (generalmente conocidos como quesos de pasta semidura):\nhumedad entre 36,y 45,9 %\nQuesos de alta humedad (generalmente conocidos como de pasta blanca o macíos): humedad\nentre 46,0 y 54,9 %\nQuesos de muy alta humedad (generalmente conocidos como de pasta muy blanda o mole):\nhumedad no menor a 55,0 %.\n2.2.2.1. Los quesos de muy alta humedad se clasificaran a su vez de acuerdo a si han recibido,\nluego de la fermentación, tratamiento térmico o no en:\nQuesos de muy alta humedad tratados térmicamente.\nQuesos de muy alta humedad.\n2.3. Designación (Denominación de venta):\nTodos los productos denominados QUESO, incluirán el nombre de la variedad si corresponde,\nsiempre que responda a las características de la variedad de que se trate, especificadas en un\nReglamento Técnico Individual Mercosur.\nEl nombre podrá ser acompañado de las denominaciones establecidas en la clasificación.\n3.--Referencias\nNorma FIL 4A: 1982. Quesos y quesos procesados.']","Respuesta: En base al contexto proporcionado, se entiende por cerveza una bebida alcohólica que se obtiene a través de la fermentación de ingredientes como la cebada, el lúpulo, el agua y la levadura. La cerveza es una bebida popular consumida en muchos países y puede variar en sabor, color y contenido alcohólico dependiendo de los ingredientes y el proceso de elaboración utilizado.","Se entiende exclusivamente por cerveza la bebida resultante de fermentar, mediante
levadura cervecera, al mosto de cebada malteada o de extracto de malta, sometido
previamente a un proceso de cocción, adicionado de lúpulo. Una parte de la cebada
malteada o de extracto de malta podrá ser reemplazada por adjuntos cerveceros.
La cerveza negra podrá ser azucarada.
La cerveza podrá ser adicionada de colorantes, saborizantes y aromatizantes.",0.0,0.0,0.8504901613647592,0.0,Basic
¿Qué se entiende por cerveza?,"['Con el nombre de Queso Tilsit se entiende el queso madurado que se obtiene por coagulación de la leche por medio del cuajo y/u otras enzimas coagulantes apropiadas, complementada o no por la acción de bacterias lácticas específicas.', 'Se entiende por crema de leche a granel de uso industrial como la crema transportada en volumen de un establecimiento industrializador de productos lácteos a otro, a ser procesada y que no sea destinada directamente al consumidor final.', 'Con el nombre de Queso Pategrás Sandwich se entiende el queso madurado que se obtiene por coagulación de la leche por medio del cuajo y/u otras enzimas coagulantes apropiadas, complementada o no por la acción de bacterias lácticas específicas.', 'La cerveza se entiende como un producto en polvo que, al dispersarse en agua y/o leche, con o sin el agregado de edulcorantes nutritivos, huevos y/o yemas y por posterior congelamiento, permite la obtención casera de postres para consumir helados. Los ingredientes permitidos para elaborar estos polvos para preparar postres incluyen almidones, grasas comestibles, leche en polvo, edulcorantes nutritivos, huevos, yemas, claras deshidratadas, crema de leche en polvo, dulce de leche, frutas secas, productos fruitivos como cacao, chocolate, café, malta, granos o semillas, y aditivos autorizados como ácidos orgánicos y sus mezclas y sales alcalinas.']","La cerveza se entiende como un producto en polvo que, al dispersarse en agua y/o leche, con o sin el agregado de edulcorantes nutritivos, huevos y/o yemas y por posterior congelamiento, permite la obtención casera de postres para consumir helados. Los ingredientes permitidos para elaborar estos polvos para preparar postres incluyen almidones, grasas comestibles, leche en polvo, edulcorantes nutritivos, huevos, yemas, claras deshidratadas, crema de leche en polvo, dulce de leche, frutas secas, productos fruitivos como cacao, chocolate, café, malta, granos o semillas, y aditivos autorizados como ácidos orgánicos y sus mezclas y sales alcalinas.","Se entiende exclusivamente por cerveza la bebida resultante de fermentar, mediante
levadura cervecera, al mosto de cebada malteada o de extracto de malta, sometido
previamente a un proceso de cocción, adicionado de lúpulo. Una parte de la cebada
malteada o de extracto de malta podrá ser reemplazada por adjuntos cerveceros.
La cerveza negra podrá ser azucarada.
La cerveza podrá ser adicionada de colorantes, saborizantes y aromatizantes.",0.0,1.0,0.8927739853298892,0.0,Advanced
¿Cómo se clasifican las cervezas?,[],"Las cervezas se pueden clasificar de diversas formas, pero una de las clasificaciones más comunes es según su fermentación. En este sentido, las cervezas se dividen principalmente en dos categorías: las cervezas de fermentación alta y las cervezas de fermentación baja. Las cervezas de fermentación alta son aquellas que fermentan a temperaturas más altas y suelen tener un sabor más afrutado y complejo, mientras que las cervezas de fermentación baja fermentan a temperaturas más bajas y suelen ser más limpias y refrescantes. Otra forma de clasificar las cervezas es según su color, su contenido alcohólico, su estilo (como las cervezas lager, ale, stout, entre otras) o su país de origen.","El contenido de nutrientes y/o del valor energético con relación
a una cerveza similar del mismo fabricante (misma marca) o del valor medio del
contenido de tres cervezas similares conocidas, que sean producidas en la región.
b. Valor energético de la cerveza lista para el consumo: máximo de 35Kcal/100 ml.
1.2.1.2 Cerveza
Es la cerveza cuyo extracto primitivo es mayor o igual a 10,5% en peso, y es menor de
12,0% en peso.
1.2.1.3. Cerveza Extra
Es la cerveza cuyo extracto primitivo es mayor o igual a 12,0% en peso y menor o
igual a 14,0% en peso.
1.2.1.4 Cerveza Fuerte
Es la cerveza cuyo extracto primitivo es mayor a 14.0% en peso.
1.2.2 Respecto al grado alcohólico
1.2.2.1 Cerveza sin alcohol
Se entiende por cerveza sin alcohol a la cerveza cuyo contenido alcohólico es inferior o
igual a 0,5% en volumen (0,5% vol.).
1.2.2.2 Cerveza con alcohol o Cerveza
Es la cerveza cuyo contenido alcohólico es superior a 0,5% en volumen (0,5% vol.)
1.2.3 Respecto al color
1.2.3.1 Cerveza clara, blanca, rubia o Cerveza
Es la cerveza cuyo color es inferior a 20 unidades E.B.C. (European Brewery
Convention).
1.2.3.2 Cerveza oscura o Cerveza negra
Es la cerveza cuyo color es igual o superior a 20 unidades E.B.C. (European Brewery
Convention).
1.2.4 Respecto a la proporción de materias primas.
1.2.4.1 Cerveza
Es la cerveza elaborada a partir de un mosto cuyo extracto primitivo contiene un
mínimo de 55% en peso de cebada malteada.
1.2.4.2 Cerveza 100% malta o de pura malta
Es la cerveza elaborada a partir de un mosto cuyo extracto primitivo proviene
exclusivamente de cebada malteada.
1.2.4.3 Cerveza de ... (seguida del nombre del o de los cereales mayoritarios).
Es la cerveza elaborada a partir de un mosto cuyo extracto primitivo proviene
mayoritariamente de adjuntos cerveceros. Podrá tener hasta un 80% en peso de la
totalidad de los adjuntos cerveceros referido a su extracto primitivo (no menos del
20% en peso de malta). Cuando dos o más cereales aporten igual cantidad de extracto
primitivo deben citarse todos ellos.
1.2.5 Respecto a otros ingredientes
1.2.5.1 Cerveza coloreada
Es la cerveza a la que se le ha adicionado colorante/ s aprobado/s en MERCOSUR,
(exceptuando cuando se usa colorante caramelo para estandarizar la coloración,
natural propia de la cerveza) para modificar las coloraciones propias naturales de la
cerveza. Esta clasificación debe tener el mismo realce que las clasificaciones definidas
en los numerales 1.2.1, 1.2.2 y 1.2.4 Ejemplo: CERVEZA DE ARROZ LIVIANA
COLOREADA.
Las siguientes clasificaciones deben tener el mismo realce que las clasificaciones
definidas en los numerales 1.2.1, 1.2.2, 1.2.3, 1.2.4 y 1.2.5.1.
1.2.5.2 Cerveza con ... (seguido del nombre del vegetal) Es la cerveza a la que se le
ha adicionado jugo y/o extracto de origen vegetal (referido a la concentración de jugo)
hasta un máximo de 10% en volumen.
Ejemplo: cerveza de arroz LIVIANA con limón.
1.2.5.3. Cerveza sabor de ... (seguido del nombre del vegetal) o cerveza con aroma de
(seguido del nombre del vegetal).
Es la cerveza a la que se le ha adicionado aroma/ s aprobado/s en MERCOSUR.
Ejemplo: CERVEZA DE ARROZ LIVIANA CON AROMA DE LIMON.
1.2.5.4 Cerveza oscura o negra azucarada o Malzbier.
Es la cerveza oscura negra a la que se le ha adicionado azúcares de origen vegetal
hasta, un máximo de 50% con relación al extracto primitivo (incluyendo los azúcares
de origen vegetal empleados corno adjuntos cerveceros), para conferirle sabor dulce.",0.0,1.0,0.9927120849722807,0.0,Basic
¿Cómo se clasifican las cervezas?,[],"Las cervezas se pueden clasificar de diversas formas, pero una de las clasificaciones más comunes se basa en el tipo de fermentación que han experimentado. Según este criterio, las cervezas se dividen principalmente en dos categorías: las cervezas de fermentación alta y las cervezas de fermentación baja. Las cervezas de fermentación alta son aquellas que han sido fermentadas a temperaturas más altas y con levaduras que trabajan en la parte superior del mosto, mientras que las cervezas de fermentación baja son aquellas que han sido fermentadas a temperaturas más bajas y con levaduras que trabajan en la parte inferior del mosto. Esta distinción es fundamental para comprender las diferencias entre estilos de cerveza como las ales y las lagers.","El contenido de nutrientes y/o del valor energético con relación
a una cerveza similar del mismo fabricante (misma marca) o del valor medio del
contenido de tres cervezas similares conocidas, que sean producidas en la región.
b. Valor energético de la cerveza lista para el consumo: máximo de 35Kcal/100 ml.
1.2.1.2 Cerveza
Es la cerveza cuyo extracto primitivo es mayor o igual a 10,5% en peso, y es menor de
12,0% en peso.
1.2.1.3. Cerveza Extra
Es la cerveza cuyo extracto primitivo es mayor o igual a 12,0% en peso y menor o
igual a 14,0% en peso.
1.2.1.4 Cerveza Fuerte
Es la cerveza cuyo extracto primitivo es mayor a 14.0% en peso.
1.2.2 Respecto al grado alcohólico
1.2.2.1 Cerveza sin alcohol
Se entiende por cerveza sin alcohol a la cerveza cuyo contenido alcohólico es inferior o
igual a 0,5% en volumen (0,5% vol.).
1.2.2.2 Cerveza con alcohol o Cerveza
Es la cerveza cuyo contenido alcohólico es superior a 0,5% en volumen (0,5% vol.)
1.2.3 Respecto al color
1.2.3.1 Cerveza clara, blanca, rubia o Cerveza
Es la cerveza cuyo color es inferior a 20 unidades E.B.C. (European Brewery
Convention).
1.2.3.2 Cerveza oscura o Cerveza negra
Es la cerveza cuyo color es igual o superior a 20 unidades E.B.C. (European Brewery
Convention).
1.2.4 Respecto a la proporción de materias primas.
1.2.4.1 Cerveza
Es la cerveza elaborada a partir de un mosto cuyo extracto primitivo contiene un
mínimo de 55% en peso de cebada malteada.
1.2.4.2 Cerveza 100% malta o de pura malta
Es la cerveza elaborada a partir de un mosto cuyo extracto primitivo proviene
exclusivamente de cebada malteada.
1.2.4.3 Cerveza de ... (seguida del nombre del o de los cereales mayoritarios).
Es la cerveza elaborada a partir de un mosto cuyo extracto primitivo proviene
mayoritariamente de adjuntos cerveceros. Podrá tener hasta un 80% en peso de la
totalidad de los adjuntos cerveceros referido a su extracto primitivo (no menos del
20% en peso de malta). Cuando dos o más cereales aporten igual cantidad de extracto
primitivo deben citarse todos ellos.
1.2.5 Respecto a otros ingredientes
1.2.5.1 Cerveza coloreada
Es la cerveza a la que se le ha adicionado colorante/ s aprobado/s en MERCOSUR,
(exceptuando cuando se usa colorante caramelo para estandarizar la coloración,
natural propia de la cerveza) para modificar las coloraciones propias naturales de la
cerveza. Esta clasificación debe tener el mismo realce que las clasificaciones definidas
en los numerales 1.2.1, 1.2.2 y 1.2.4 Ejemplo: CERVEZA DE ARROZ LIVIANA
COLOREADA.
Las siguientes clasificaciones deben tener el mismo realce que las clasificaciones
definidas en los numerales 1.2.1, 1.2.2, 1.2.3, 1.2.4 y 1.2.5.1.
1.2.5.2 Cerveza con ... (seguido del nombre del vegetal) Es la cerveza a la que se le
ha adicionado jugo y/o extracto de origen vegetal (referido a la concentración de jugo)
hasta un máximo de 10% en volumen.
Ejemplo: cerveza de arroz LIVIANA con limón.
1.2.5.3. Cerveza sabor de ... (seguido del nombre del vegetal) o cerveza con aroma de
(seguido del nombre del vegetal).
Es la cerveza a la que se le ha adicionado aroma/ s aprobado/s en MERCOSUR.
Ejemplo: CERVEZA DE ARROZ LIVIANA CON AROMA DE LIMON.
1.2.5.4 Cerveza oscura o negra azucarada o Malzbier.
Es la cerveza oscura negra a la que se le ha adicionado azúcares de origen vegetal
hasta, un máximo de 50% con relación al extracto primitivo (incluyendo los azúcares
de origen vegetal empleados corno adjuntos cerveceros), para conferirle sabor dulce.",0.0,0.0,0.9927120849722807,0.0,Advanced
¿Qué se define como sidra?,[],"La sidra se define como una bebida alcohólica obtenida a partir de la fermentación del jugo de manzana. Es una bebida tradicional en varias regiones del mundo, especialmente en Europa, y puede variar en sabor y contenido alcohólico dependiendo del proceso de elaboración y los ingredientes utilizados.","SIDRAS
Artículo 1085 - (Resolución Conjunta SPRyRS N° 87/04 y SAGPyA N° 566/04)
“Sidra Base es la bebida que resulta exclusivamente de la fermentación alcohólica
normal del jugo recién obtenido de manzanas sanas y limpias, de uso industrial, con o
sin la adición de hasta un 10% de jugo de peras obtenido en idénticas condiciones que
el jugo de manzana y fermentado en forma conjunta o separada. Su graduación
alcohólica mínima será de 4,5% en Vol. ±0,3 a 20°C.""",0.0,0.0,0.8888045076119409,0.5,Basic
¿Qué se define como sidra?,[],"La sidra se define como una bebida alcohólica obtenida a partir de la fermentación del jugo de manzana. La fermentación puede ser natural o inducida, y el grado alcohólico de la sidra puede variar dependiendo del proceso de elaboración y del país de origen. La sidra puede ser dulce, semiseca o seca, y es una bebida popular en varias regiones del mundo, especialmente en Europa y América del Norte.","SIDRAS
Artículo 1085 - (Resolución Conjunta SPRyRS N° 87/04 y SAGPyA N° 566/04)
“Sidra Base es la bebida que resulta exclusivamente de la fermentación alcohólica
normal del jugo recién obtenido de manzanas sanas y limpias, de uso industrial, con o
sin la adición de hasta un 10% de jugo de peras obtenido en idénticas condiciones que
el jugo de manzana y fermentado en forma conjunta o separada. Su graduación
alcohólica mínima será de 4,5% en Vol. ±0,3 a 20°C.""",0.0,0.0,0.8033833441594496,0.0,Advanced
¿Se pueden añadir aromas a los vinos?,"['b) Los que contengan huevo, yema de huevo, leche en polvo, crema en polvo o sus mezclas,\ndeberán ser envasados en recipientes herméticos o al vacío, impermeables a la luz, gases y\nhumedad.\nSi el envase fuere permeable a la luz deberá incluirse en otro que lo proteja de su acción,el que\ndeberá rotularse igual que el envase primario.\nc) Cuando el producto alimenticio agregado sea el que le confiere sabor y/o aroma, podrán\nrotularse: Polvo para preparar ... al ..., llenando el primer espacio en blanco con el nombre de\nla preparación y el segundo con el de la substancia agregada.\nd) Cuando los polvos para preparar postres hubieran sido adicionados de aromatizantes /\nsaborizantes, deberán llevar en el rótulo la expresión “ Con aromatizante / saborizante...”,\nllenando el espacio en blanco con el nombre correspondiente de acuerdo con el aroma y/o\nsabor y con la clasificación que figura en el presente Código.\ne) Cuando hubieran sido aromatizados con vainillina, etilvainillina, deberá declararse en el\nrótulo: Aromatizado con ..., llenando el espacio en blanco con el nombre que corresponda.\nArtículo 766 - (Dec. 61, 17.1.77)\n""Queda prohibida la circulación, tenencia y expendio de galletitas, bizcochos y productos\nsimilares (tales como barquillos, vainillas, amaretis, etc.) que:\na) Se encuentren mal elaborados o imperfectamente cocidos.\nb) Contengan substancias extrañas a su composición normal.\nc) Presenten sabor y/o aroma u olor impropios del producto.\nd) Estuvieren enmohecidos, alterados, averiados, atacados por parásitos.\ne) Se hubiere sustituido el huevo o la yema de huevo por colorante de cualquier naturaleza en\nlos rotulados con o al huevo.\nf) Cuando sean elaborados con almendras, contengan mas de 40 mg/kg (40 ppm) de ácido\ncianhídrico.\ng) Se encuentren expuestos a contaminación de cualquier naturaleza (mineral, orgánica o\nmicrobiana).\nh) Se encuentren en envases inapropiados o en deficientes condiciones higiénicas.\nLos productos que no cumplimenten una o más de las condiciones establecidas\nprecedentemente, serán decomisados sin perjuicio de cualquier otra acción que correspondiere""', 'caracteres de igual tamaño, realce y visibilidad: Polvo para preparar flan con o sin huevo,\nsegún corresponda, y especificando que deben ser preparados con el agregado de leche.\nd) Cuando el producto alimenticio agregado sea el que le confiere sabor y/o aroma, podrán\nrotularse: Polvo para preparar ... al ..., llenando el primer espacio en blanco con el nombre de\nla preparación y el segundo con el de la substancia agregada.\ne) Cuando los polvos para preparar postres hubieran sido adicionados de saborizantes /\naromatizantes, deberán llevar en el rótulo la expresión: ‘Con aromatizante / saborizante...’,\nllenando el espacio en blanco con el nombre correspondiente de acuerdo con el aroma y/o\nsabor y con la clasificación que figura en el presente Código.\nf) Cuando hubieran sido aromatizados con vainillina, etilvainillina, deberá declararse en el\nrótulo: Aromatizado con ..., llenando el espacio en blanco con el nombre que corresponda.\ng) Los polvos para preparar postres que no les corresponda una denominación específica, se les\nasigne un nombre de fantasía o sean de marca registrada y que según las indicaciones\npermitan obtener un producto de consistencia cremosa, podrán consignar en el rótulo por\nencima o por debajo del nombre de fantasía o marca, la leyenda: Postre cremoso.\nh) Los polvos para preparar postres a los que no les corresponda una denominación específica\ny que según las indicaciones permiten la obtención de un producto de consistencia cremosa\npero que corresponda a un producto alimenticio determinado, podrán rotularse: Postre-crema\nde ..., siempre que los dos primeros vocablos se encuentren formando una sola frase con\ncaracteres de igual tamaño, realce y visibilidad y separados por un guión y llenando el espacio\nen blanco con el nombre del producto que le comunica las características sápido-aromáticas,\npor ejemplo: Postre-crema de chocolate, Postre-crema de cacao"".\nArtículo 818bis - (Res 888, 7.10.86)\n""Con la denominación genérica de Polvos o mezclas para preparar postres para helar, se\nentienden los productos en polvo que por dispersión en agua y/o leche, con o sin el agregado\nde edulcorantes nutritivos, huevos y/o yemas y por posterior congelamiento, permiten la\nobtención casera de postres para consumir helados.\nPodrán elaborarse con los siguientes ingredientes que responda a las exigencias del presente\nCódigo:\na) Almidones, féculas o sus mezclas y dextrinas.\nb) Grasas comestibles.\nc) Leche en polvo (entera, parcial o totalmente descremada).\nd) Edulcorantes nutritivos.\ne) Huevos, yemas y/o claras deshidratadas.\nf) Crema de leche en polvo.\ng) Dulce de leche.\nh) Frutas secas (tostadas o no), desecadas o deshidratadas, confitadas, enteras, en trozos,\nmolidas.\ni) Productos fruitivos: cacao, chocolate, café, malta.\nj) Granos o semillas: enteros, en trozos, molidos, tostados o no.\nQueda permitido el agregado de los siguientes aditivos autorizados por el presente Código:\n1. Acidos orgánicos y/o sus mezclas y/o sus sales alcalinas.', 'como mínimo del peso neto total del producto terminado.\nEn el rótulo se declarará expresamente el ""peso escurrido"" y el ""peso neto"".\nArtículo 479\nSe considera Conservas de atún, las conservas preparadas con trozos y filetes de pescados de\nnombres comunes, albacora, atún patudo, atún rojo, rabil, barrilete, melba y bonito, procedentes\nde piezas descabezadas, evisceradas y privadas de cola, piel, branquias, espinas, huevas y carne\nnegra, sazonadas con sal, cocidas al vapor o en salmuera y secadas adecuadamente antes del\nenvasamiento.\nLa caballa podrá designarse Atún argentino cuando se prepare exclusivamente con las partes\nblancas de la carne desprovista de piel, sangre y espinas.\nEstas conservas podrán serlo en aceite, aceite de oliva o en salsa de tomate.\nArtículo 480\nSe entiende por Bouillabaisse, la conserva de pescado, elaborada con diversos pescados y\nmariscos cocidos y adicionados de aditivos de uso permitido.\nArtículo 481 - (Res MSyAS 29, 15.08.95)\n""Se entiende por Conserva de pescado, la conserva de pescado con el agregado de salmuera de\nbaja concentración o caldo.\nLa salmuera o caldo no podrán hallarse en proporción superior al treinta y tres (33) por ciento,\nni inferior al cinco (5) por ciento del peso neto total del producto terminado.\nEn el rótulo se declarará expresamente el ""peso escurrido"" y el ""peso neto"".\nEstos productos se rotularán indicando únicamente el nombre del pescado envasado (por ej:\nMerluza, Caballa, etc) en salmuera o caldo o al natural. Cuando no tengan ningún agregado se\nrotulará en conserva (por ej: Merluza en conserva o Merluza)"".\nArtículo 482\nSe entiende por Conserva de mariscos, la conserva de mariscos desprovistos de sus valvas,\nadicionada de salmuera o caldo.\nLa salmuera o caldo no podrá hallarse en proporción superior al 50% del peso total del producto\nterminado.\nEstos productos se rotularán indicando únicamente el nombre del marisco.\n(Res 846, 30.7.76) ""La carne de pescados frescos, moluscos o crustáceos así como la de sus\nconservas, no deberá contener mercurio en cantidad superior a 0,5 mg/kg (0,5 ppm) y de esa\ncifra no más de 0,3 mg/kg (0,3 ppm) (expresada como mercurio) podrá encontrarse como\ncompuestos metilmercuriales.""\nArtículo 483\nSe entiende por Caviar, el producto hecho con huevas de varias especies de esturiones y sal.\nArtículo 484\n1025\nSe entiende por Caviar fresco o granulado (Ikra, Koernigerkaviar), el caviar de color gris que\npresente las huevas muy aglutinadas, que no contenga más de 55% de agua, ni de 18% de\nmaterias grasas, ni menos de 23% de prótidos totales (NT x 6,25).\nArtículo 485\nSe entiende por Caviar prensado (Pauloresnaria, Presskavier), el caviar que presenta aspecto de\nmasa compacta, aceitosa, de color gris oscuro o negro.\nNo debe contener más de 35% de agua, ni menos de 33% de prótidos totales (NT x 6,25).\nNo deberá contener aceite o huevas de otros peces.\nArtículo 486 - (Resolución Conjunta N° 23/2003 y N° 251/2003)\nSe entiende por ""Caviar de…"" el producto, preparado como caviar, con huevas de otros peces.', '(seguido del nombre del vegetal).\nEs la cerveza a la que se le ha adicionado aroma/ s aprobado/s en MERCOSUR.\nEjemplo: CERVEZA DE ARROZ LIVIANA CON AROMA DE LIMON.\n1.2.5.4 Cerveza oscura o negra azucarada o Malzbier.\nEs la cerveza oscura negra a la que se le ha adicionado azúcares de origen vegetal\nhasta, un máximo de 50% con relación al extracto primitivo (incluyendo los azúcares\nde origen vegetal empleados corno adjuntos cerveceros), para conferirle sabor dulce.\n1.3 Designación (denominación de venta)\n1.3.1. Cerveza\nSe designa con el nombre de cerveza a la bebida definida en el numeral 1.1.1. y que\ncumple con las características establecidas en los numerales 1.2.1.2., 1.2.2.2., 1.2.3.1\ny 1.2.4.1.\n1.3.2. Cerveza liviana y Cerveza Light.\nSe designa con el nombre de cerveza light a la cerveza que cumple con las\ncaracterísticas establecidas en el numeral 1.2.1.1.\n1.3.3. Cerveza extra\nPara designar una cerveza como cerveza extra la misma deberá cumplir con las\ncaracterísticas establecidas en el numeral 1.2.1.3.\n1.3.4. Cerveza fuerte.\nPara designar una cerveza como cerveza fuerte, la misma deberá cumplir con las\ncaracterísticas establecidas en el numeral 1.2.1.4.\n1.3.5. Cerveza sin alcohol.\nSe designa con el nombre de cerveza sin alcohol, a la cerveza que cumple con las\ncaracterísticas establecidas en el numeral 1.2.2.1.\n1.3.6. Cerveza oscura o Cerveza negra.\nSe designa con el nombre de cerveza oscura o cerveza negra a la cerveza que cumple\ncon las características establecidas en el numeral 1.2.3.2.\n1.3.7. Cerveza 100% malta o de pura malta.\nSe podrá designar con el nombre de cerveza 100% malta o de pura malta a la cerveza\nque cumple con las características establecidas en el numeral 1.2.4.2.\n1.3.8. Cerveza de ... (seguido del nombre del adjunto cervecero mayoritario).\nSe designa con el nombre de cerveza de ... (seguido del nombre del adjunto\nmayoritario) a la cerveza que cumple con las características establecidas en el numeral\n1.2.4.3.\n1.3.9. Cerveza (seguida de la clase definida en 1.2.1., 1.2.2. y 1.2.4.) coloreada.\nSe designa con el norma de cerveza ... coloreada a la cerveza que cumple con las\ncaracterísticas establecidas en el numeral 1.2.5.1. Ejemplo: Cerveza de Arroz Liviana\nColoreada.\n1.3.10. Cerveza (Seguida de la clase definida en 1.2.1., 1.2.2., 1.2.4. y 1.2.5.1.) con\n... ""seguida del nombre del vegetal).\nSe designa con el nombre de cerveza ... con ... a la cerveza que cumple con las\ncaracterísticas establecidas en el numeral 1.2.5.2. Ejemplo: CERVEZA DE ARROZ\nLIVIANA CON LIMON COLOREADA\n1.3.11 Cerveza (seguida de la clase definida en 1.2.1, 1.2.2, 1.2.4 y 1.2.5.1) sabor de\n... (seguida del nombre del vegetal) o cerveza (seguida de la clase definida en 1.2.1,\n1.2.2, 1.2.4 y 1.2.5.1) con aroma de ... (seguida del nombre del vegetal).\nSe designa con el nombre de cerveza ... sabor de ... o cerveza ... con aroma de... a la\ncerveza que cumple con las características establecidas en el numeral 1.2.5.3.\nEjemplo: CERVEZA DE ARROZ LIVIANA CON AROMA DE LIMÓN COLOREADA.', 'aroma y/o sabor y con la clasificación que figura en el presente Código.\n3. Cuando contengan vainillina, etilvainillina, canela, especias, condimentos, deberá\nconsignarse la leyenda: Con..., llenando el espacio en blanco con el nombre de la substancia\ncorrespondiente.\n4. Cuando contengan substancias grasas de cualquier origen, deberá consignarse su\nporcentualidad (con X% de grasa) inmediatamente por debajo de la denominación, con\ncaracteres de buen tamaño, realce y visibilidad.\n5. Cuando se rotulen: al huevo o con huevo, deberán contener sobre substancia seca, no\nmenos de 40,0 mg/100 g de colesterol proveniente de la yema, y en estos casos queda\npermitido el refuerzo de la coloración amarilla por el agregado de los colorantes permitidos\npara este tipo de productos sin que ello importe la supresión del huevo en la forma prescripta.\nSin perjuicio de estas exigencias particulares, podrán llevar en el rotulo toda otra indicación\nreferente a las materias primas o substancias adicionadas. Los envases de diferentes tamaños\nque contengan estos productos y que se expendan al peso deberán llevar en el rótulo y de la\nmisma manera las especificaciones citadas precedentemente”\nLas galletitas tipo crackers con o sin salvado tendrán como máximo 890 mg de sodio/ 100 g de\nproducto.\nLas galletitas dulces tendrán como máximo 485 mg de sodio/100 g producto y las galletitas\ndulces rellenas tendrán como máximo 405 mg de sodio/100 g producto. Las galletas dulces\nrellenas con un contenido de cacao superior a 4,5% sobre el producto total tendrán cómo\nmáximo 425mg/100 g.\nArtículo 760 bis — (Resolución Conjunta SPRyRS N° 31/2003 y SAGPYA N°\n286/2003)\nSe autoriza en los productos de panificación y galletitería el uso de los aditivos que se\nconsignan a continuación:\nAditivo: Aditivo: Aditivo:\nNúmero FUNCIÓN / Nombre Concentración máxima\nINS g/100g\nBIZCOCHOS, GALLETITAS Y PRODUCTOS SIMILARES, CON O SIN RELLENO,\nRECUBIERTOS O NO\nACIDULANTE\nTodos los autorizados como BPF en el presente Código qs\n334 Ácido tartárico 0,5\n355 Ácido adípico 0,2\n338 Ácido fosfórico 2,0 (como P O )\n2 5\nREGULADOR DE LA ACIDEZ\nTodos los autorizados como BPF en el presente Código qs\n335i Sodio-(mono) Tartrato 0,5\n335ii Sodio-(di) Tartrato 0,5\n336 i Potasio Tartrato Ácido 0,5\n336ii Potasio Tartrato Neutro, Potasio d-Tartrato, Potasio- 0,5\n(di) Tartrato\n337 Potasio y Sodio Tartrato 0,5\n339i Sodio-(mono) Fosfato, Sodio Monofosfato, Sodio- 2,0 (como P O )\n2 5\n(mono) Ortofosfato\n339ii Sodio-(di) Fosfato, Sodio-(di) Monofosfato, Sodio- 2,0 (como P O )\n2 5\n(di) Ortofosfato\n340i Potasio-(mono) Fosfato, Potasio Fosfato Ácido, 2,0 (como P O )\n2 5\nPotasio-(mono) Ortofosfato\n340ii Potasio-(di) Fosfato, Potasio-(di) Monofosfato, 2,0 (como P O )\n2 5\nPotasio-(di) Ortofosfato\n341iii Calcio-(tri) Fosfato, Calcio Fosfato Tribásico 2,0 (como P O )\n2 5\nANTIAGLUTINANTE\nTodos los autorizados como BPF en el presente Código qs\n341iii Calcio-(tri) Fosfato, Calcio Fosfato Tribásico 2,5 (como P2O5)\nANTIOXIDANTE\nTodos los autorizados como BPF en el presente Código qs', 'significa el porcentaje de jugo empleado) (Res MSyAS n° 538, 2.08.94) ""llenando el espacio\nen blanco con el nombre de la fruta u hortaliza, con caracteres de igual tamaño, realce y\nvisibilidad"".\n(Res MSyAS N° 538, 2.08.94) ""Para el caso de envases de vidrio ""Vitrificados y/o Pintados""\nel rotulado podrá consignarse en la parte plana de la tapa"".\nAsimismo podrán denominarse por ejemplo: naranja, limón, pomelo, seguido de ""Y"" donde Y\nsignifica marca o nombre de fantasía sólo cuando la denominación constituya una marca\nregistrada, antes de la fecha de entrada en vigencia de la presente norma.\n(Res N° 305 del 26.03.93) - ""Las bebidas sin alcohol (gasificadas o no) deberán consignar la\nfecha de vencimiento (día, mes y año o mes y año, según corresponda).\nLa fecha de vencimiento debe ser estipulada por el fabricante responsable"".\nQuedan permitidas en el rótulo y/o publicidad, representaciones gráficas relativas a las frutas u\nhortalizas empleadas cuando el contenido de jugo en las bebidas listas para el consumo directo\nsea como mín. 50% v/v. Hacen excepción las bebidas a base de jugo de limón para las que se\nadmitirá un mín. de 25% v/v"".\nArtículo 999 - (Res N° 613, 10.5.88)\n""Las bebidas sin alcohol, gasificadas o no, que contengan menos de 10% de jugo v/v y como\nmínimo 5% de jugo v/v elaboradas con jugos, jugos concentrados y/o jugos y pulpas de frutas\nu hortalizas, excepto en el caso de jugo de limón donde el mismo será de 2,5%, podrán ser\nadicionadas de:\na) Extractos naturales y/o esencias naturales y/o compuestos químicos aislados de los mismos.\nb) Esencias artificiales o una mezcla de éstas con los consignados en el Inc a).\nLas bebidas no gasificadas tendrán como máximo 12° Brix y deberán llevar la indicación ""Para\nconsumo directo"".\nEstas bebidas gasificadas, o no, se rotularán:\nBebida sin alcohol con sabor a ... (llenando el espacio en blanco con el nombre de la fruta u\nhortaliza que las caracterizan) o Bebida sin alcohol con sabor artificial a ... (llenando el espacio\nen blanco con el nombre de la fruta u hortaliza cuyo sabor imitan), según se encuentren\naromatizadas de acuerdo a lo consignado en el Inc a) o en el Inc b), respectivamente.\n(Res MSyAS N° 538, 2.08.94) ""Todos los caracteres que indican el tipo de bebida deberán\ntener buen realce y visibilidad""\n(Res MSyAS N° 538, 2.08.94) ""Para el caso de envases de vidrio vitrificado y/o pintados el\nrotulado podrá consignarse en la parte plana de la tapa"".\nPara bebidas no gasificadas deben consignarse la fecha de elaboración (mes y año) y el lapso\nde aptitud o fecha de vencimiento (mes y año).\nQueda prohibido insertar en rótulos y/o publicidad, cualquier representación gráfica relativa a\nfrutas u hortalizas ni indicaciones referentes a las proporciones de jugo o jugo/pulpa que\ncontenga"".\nArtículo 1000 - (Res N° 613, 10.5.88)\n""Queda permitida la elaboración de bebidas sin alcohol gasificadas o no, con extractos,\ninfusiones, maceraciones, percolaciones, de café, zarzaparrilla, té, yerba mate, macis, semillas', 'singularizando los envases de distinto tamaño cuando los hubiera.\n3. En el acto de subasta deberá exhibirse al público copia del inventario indicado en el Inc 2,\nfirmada por el responsable de la venta y visada por la autoridad sanitaria, con la declaración\nde que dichas mercaderías son aptas para el consumo según el presente.\n4. Los locales en que se efectúan remates de productos alimenticios serán mantenidos en\nadecuadas condiciones sanitarias.\n5. En los locales a que se refiere el apartado anterior no se permitirá el fraccionamiento o\ntrasvasamiento de las mercaderías sometidas a remate.', 'deberá estar expresada en grados enteros sin fracciones.\nEl vinagre obtenido de diversas materias primas, pero de un mismo origen, cereales por\nejemplo, además de la designación genérica que le corresponde (Vinagre de cereal) será\nobligatorio que, a continuación o debajo, lleve indicados los nombres de las mismas, por ej:\ncebada y centeno; quedando expresamente prohibida la elaboración de vinagre con materias\nprimas de distinto origen, por ej: fruta y cereal, y también, la mezcla de vinagre de distinto\norigen en todo tipo de establecimiento y los de un mismo origen en locales que no sean los de\nelaboración.\nEn los casos permitidos no solamente deberá declararse la mezcla, sino también su proporción.\nEl vinagre de vino no se puede mezclar con otros vinagres, ni aún cuando éstos sean del\nmismo origen (de frutas) y que la mezcla se declare en el rotulado.\nTampoco se puede mezclar el vinagre de suero de leche con otros vinagres.\nLas materias primas que se utilicen (vino, miel, cerveza, sidra, aguardiente, brandy, alcohol,\netc) no presentarán otra ineptitud para el consumo que el desarrollo en ellas del Mycoderma\naceti.\nQueda prohibido elaborar vinagres con materias primas (fruta, cereal, miel, etc), ineptas para\nel consumo por otro motivo que no sea el antedicho; con vinos no genuinos, con olores o\nsabores extraños, alterados por fermentación manítica o cualquier otra enfermedad y/o con\nvino procedente del prensado de las heces sobrantes de la vinificación o con restos de vinos\nsobrantes de casas de comida o despacho de bebidas"".\nArtículo 1330 - Res 80, 13.1.82\n""Todo ácido acético que se encuentre en una fábrica de vinagre, en un establecimiento\nelaborador o fraccionador de productos alimenticios en los que se utilice vinagre o en un\ncomercio que lo venda al detalle deberá considerarse como destinado a la adulteración del\nproducto genuino y será intervenido en el acto, sin perjuicio de la sanción penal que\ncorresponda"".\nArtículo 1331 - Resolución Conjunta SPReI y SAV N° 1-E/2018\n""En la elaboración de vinagres quedan permitidos los siguientes tratamientos:\n- La dilución del vino, solución azucarada o solución alcohólica hecha exclusivamente en la\nfábrica de vinagre y sin poder salir de ella, en la medida necesaria para su acetificación normal,\ncon agua potable o deionizada.\n- El empleo de clarificantes admitidos por el presente Código para alimentos y bebidas en\ngeneral, tales como: Tierra de infusorios, Bentonita, PVP, Tanino y Gelatina.\n- La aromatización con estragón (hojas desecadas de Arthemisia dracunculus L.), laurel y otras\nespecies vegetales, condimentos, esencias naturales y naturales reforzadas, esencias y\nextractos sápido aromatizantes sintéticos y oleorresinas autorizados por el presente Código,\nexclusivamente para los vinagres de vino y de fruta. La aromatización deberá declararse en el\nrotulado en forma bien visible y cuando proceda de aromas artificiales, con la indicación de\nAromatizado artificialmente.', 'oficialmente, debiéndose obtener con uvas seleccionadas (apropiadas), elaborados con\ntécnicas adecuadas y sometidos a un añejamiento comprobado oficialmente, de por lo\nmenos dos años.\nEn el rótulo de los envases podrá indicarse el año de elaboración.\nc) Reserva: Son los vinos blancos, tintos, claretes o rosados que han sido sometidos a\nun añejamiento comprobado oficialmente, de por lo menos dos años.\nEn los rótulos de los envases podrá indicarse el año de elaboración.\nArtículo 1096\nLos vinos y mistelas importados, para su inscripción, deberán acompañarse del\ncertificado expedido por laboratorios del país de producción que hayan sido\nespecialmente autorizados y deberán estar debidamente legalizados.\nArtículo 1097\nNo se considerarán como vinos genuinos, seguidos de la mención de la zona de\nproducción, los obtenidos por cortes de elaboraciones de distintas zonas de\nproducción.\nQueda prohibida la mezcla de vinos importados entre sí, así como también la mezcla\ncon vinos nacionales.\nArtículo 1098\nVinos especiales (licorosos y/o generosos):\n1. Categoría A: Es el vino seco o dulce que sin adiciones posee un grado alcohólico de\n12,5% en volumen y/o una riqueza alcohólica adquirida y en potencia no menor de 15°\nen volumen.\n2. Categoría B: Es el vino seco o dulce cuya graduación alcohólica no sea inferior a\n15% en volumen provenga, en parte, de la adición de alcohol vínico en cualquier\nmomento de su elaboración.\n3. Categoría C: Es el vino obtenido adicionando en cualquier momento de su proceso\nde indistinta, conjunta o separadamente cualquiera de los siguientes productos: mosto\nconcentrado, mistela, arrope, caramelo de uva o alcohol vínico, con una riqueza\nalcohólica total no inferior a 15° en volumen.\nArtículo 1099\nVinos espumosos o espumantes: Son los blancos, tintos, rosados, obtenidos por una\nsegunda fermentación en envase cerrado con el agregado o no de sacarosa o mosto\nconcentrado.\nDebe expenderse con una presión no inferior a 4 atmósferas a 20°C.\nArtículo1100\nVino gasificado: El que ha sido adicionado de anhídrido carbónico puro después de su\nelaboración definitiva, debiendo hacerse constar dicha denominación en los rótulos\nadheridos a los envases.\nArtículo 1101\nChampaña o Champagne: Son los obtenidos con vinos blancos o rosados, que previa\nadición de sacarosa y levaduras seleccionadas, se los somete a una segunda\nfermentación alcohólica en envase cerrado.\nPueden ser adicionados del llamado Licor de expedición, constituídos por vinos\nlicorosos y de coñac, para constituir los tipos: Secos (Sec), Semiseco (Demisec) y\nDulce (Doux); reservándose las denominaciones de Bruto (Brut) y Natural (Nature)\npara distinguir el producto original.\nDeben expenderse con una presión de gas carbónico no inferior a 4 atmósferas a 20°C.\nArtículo 1102\nVinos compuestos (Vermut, Vinos Quinados): Son los elaborados con no menos de\n75% en volumen de vino, adicionado o no de alcohol, con el agregado de substancias\namargas, estimulantes, aromáticas autorizadas, pudiendo añadirse azúcar, mosto\nconcentrado o mistela.']","Sí, según el contexto proporcionado, se puede añadir aromas a los vinos. En el artículo mencionado se establece que en la elaboración de vinagres, específicamente en los vinagres de vino y de fruta, se permite la aromatización con diferentes ingredientes, incluyendo esencias naturales, esencias y extractos sápido-aromatizantes sintéticos y oleorresinas autorizadas. Por lo tanto, la adición de aromas a los vinos también estaría permitida dentro de los parámetros establecidos por la normativa vigente.","Artículo 1105
Queda prohibido fabricar, exponer, expender y anunciar productos o mezclas
destinados a mejorar o dar aroma a los vinos o mostos, así como colorantes,
edulcorantes o conservadores prohibidos, o cualquiera otra substancia que tenga por
objeto engañar al consumidor sobre sus cualidades esenciales, origen o clase o con el
fin de falsear los resultados analíticos o disimular una alteración.",0.5381944444309895,0.6,0.9606899096678819,1.0,Basic
¿Se pueden añadir aromas a los vinos?,"['Sí, se pueden añadir aromas a la cerveza, siempre y cuando estén aprobados en MERCOSUR. Por ejemplo, se menciona una ""CERVEZA DE ARROZ LIVIANA CON AROMA DE LIMÓN"" como un caso específico donde se ha añadido aroma a la cerveza.', 'Sí, se pueden añadir aromas a los vinagres de vino y de fruta, siempre y cuando se declaren en el rotulado de forma visible. Se permite la aromatización con estragón, laurel y otras especies vegetales, condimentos, esencias naturales y naturales reforzadas, esencias y extractos sápido aromatizantes sintéticos y oleorresinas autorizados. La mezcla de vinagre de vino con otros vinagres no está permitida, ni siquiera si son del mismo origen, y esta mezcla debe declararse en el rotulado.', 'Sí, se pueden añadir aromas a los vinos, siempre y cuando se indique en el rótulo de forma visible y con caracteres claros si se trata de aromatizantes artificiales autorizados, colorantes naturales y/o sintéticos autorizados, o espesantes-estabilizantes autorizados. En el caso específico de aromatizar con vainillina, etilvainillina o una mezcla de estas con vainilla natural, se debe incluir en el rótulo la leyenda correspondiente.', 'Sí, se pueden añadir aromas a los vinos. En el texto se menciona que existen aromatizantes/saborizantes naturales que pueden ser añadidos a los productos, como aceites esenciales, extractos, bálsamos, oleorresinas u oleogomorresinas, y sustancias aromatizantes/saborizantes naturales aisladas. También se hace referencia a aromatizantes/saborizantes sintéticos, que son compuestos químicamente definidos obtenidos por procesos químicos.', 'Sí, se pueden añadir aromas a los vinos utilizando aromatizantes o saborizantes, como aceites esenciales o esencias naturales.', 'Sí, se pueden añadir aromas a los vinos. En el texto se menciona que los aromatizantes/saborizantes se pueden presentar en formas sólidas, líquidas o en pasta, y que existen aromatizantes autorizados que deben cumplir con requisitos de identidad y pureza establecidos por entidades como JECFA, UE (CoE), FDA o FEMA.', 'Sí, se pueden añadir aromas a los vinos según el texto proporcionado. En el apartado f) se menciona la ""Aromatización/Saborización"", que se define como la operación que consiste en utilizar sustancias aromatizantes/saborizantes permitidas en el código correspondiente en la preparación de las bebidas, lo cual incluiría a los vinos.', 'Sí, se pueden añadir aromas a los baños de repostería con leche, siempre y cuando cumplan con las regulaciones del código. Las sustancias aromatizantes permitidas deben estar de acuerdo con la clasificación y los casos particulares que figuran en el código. Sin embargo, se prohíbe el uso de aromas de sabor leche en estos productos.', 'Sí, se pueden añadir aromas a los vinos. En el caso de productos como el chocolate, cuando contienen sustancias aromatizantes, es necesario incorporar en la denominación de venta la indicación ""Con aromatizante/saborizante"" seguido del nombre correspondiente al aroma y/o sabor, de acuerdo con la clasificación establecida en el código de regulaciones.']","Sí, se pueden añadir aromas a los vinos, siempre y cuando se indique en el rótulo de forma visible y con caracteres claros si se trata de aromatizantes artificiales autorizados, colorantes naturales y/o sintéticos autorizados, o espesantes-estabilizantes autorizados. En el caso específico de aromatizar con vainillina, etilvainillina o una mezcla de estas con vainilla natural, se debe incluir en el rótulo la leyenda correspondiente. Los aromatizantes pueden ser naturales o sintéticos, y se pueden presentar en formas sólidas, líquidas o en pasta, siempre y cuando cumplan con los requisitos de identidad y pureza establecidos por entidades como JECFA, UE (CoE), FDA o FEMA.","Artículo 1105
Queda prohibido fabricar, exponer, expender y anunciar productos o mezclas
destinados a mejorar o dar aroma a los vinos o mostos, así como colorantes,
edulcorantes o conservadores prohibidos, o cualquiera otra substancia que tenga por
objeto engañar al consumidor sobre sus cualidades esenciales, origen o clase o con el
fin de falsear los resultados analíticos o disimular una alteración.",0.49999999995,1.0,0.9549032515269497,0.0,Advanced
¿Los condimentos vegetales tienen algunas restricciones?,[],"Los condimentos vegetales no suelen tener restricciones específicas en cuanto a su uso y comercialización. Por lo general, se consideran seguros para el consumo humano y suelen estar compuestos por ingredientes naturales como hierbas, especias y vegetales deshidratados. Es importante asegurarse de que cumplan con los requisitos de calidad e higiene establecidos por las autoridades sanitarias correspondientes, pero en términos de restricciones específicas, no suelen estar sujetos a regulaciones estrictas.","CONDIMENTOS VEGETALES
Artículo 1199
Con la denominación genérica de Especias o Condimentos vegetales, se comprenden ciertas
plantas o partes de ellas que por contener sustancias aromáticas, sápidas o excitantes se
emplean para aderezar, aliñar o mejorar el aroma y el sabor de los alimentos y bebidas.
Artículo 1200
Deben ser genuinas, sanas y responder a sus características normales, y estar exentas de
sustancias extrañas y de partes de la planta de origen que no posean cualidades de
condimentos (tallos, pecíolos, etc).
Las especias pueden expenderse enteras o molidas.
Las especias que se tengan en depósito, exhiban, circulen o expendan en mal estado de
conservación o atacadas por insectos o con olor a moho serán decomisadas en el acto, como
asimismo las que han sido elaboradas en malas o deficientes condiciones de higiene.
Artículo 1201
Las mezclas de especias deben estar compuestas de especias simples, sanas, limpias y
genuinas, libres de productos extraños y deberán expenderse indicando en el rótulo los
componentes de la mezcla, y cada una debe responder a las especificaciones y características
analíticas propias.",0.0,0.0,0.0,0.8,Basic
¿Los condimentos vegetales tienen algunas restricciones?,[],"Los condimentos vegetales no suelen tener restricciones específicas en cuanto a su uso y comercialización. Por lo general, se consideran seguros para el consumo humano y suelen estar compuestos por ingredientes naturales como hierbas, especias y vegetales deshidratados. Es importante asegurarse de que cumplan con las regulaciones de etiquetado correspondientes y que no contengan aditivos o ingredientes prohibidos según la normativa vigente en cada país.","CONDIMENTOS VEGETALES
Artículo 1199
Con la denominación genérica de Especias o Condimentos vegetales, se comprenden ciertas
plantas o partes de ellas que por contener sustancias aromáticas, sápidas o excitantes se
emplean para aderezar, aliñar o mejorar el aroma y el sabor de los alimentos y bebidas.
Artículo 1200
Deben ser genuinas, sanas y responder a sus características normales, y estar exentas de
sustancias extrañas y de partes de la planta de origen que no posean cualidades de
condimentos (tallos, pecíolos, etc).
Las especias pueden expenderse enteras o molidas.
Las especias que se tengan en depósito, exhiban, circulen o expendan en mal estado de
conservación o atacadas por insectos o con olor a moho serán decomisadas en el acto, como
asimismo las que han sido elaboradas en malas o deficientes condiciones de higiene.
Artículo 1201
Las mezclas de especias deben estar compuestas de especias simples, sanas, limpias y
genuinas, libres de productos extraños y deberán expenderse indicando en el rótulo los
componentes de la mezcla, y cada una debe responder a las especificaciones y características
analíticas propias.",0.0,0.0,0.0,0.8,Advanced
¿Qué caracteristicas debe tener la harina de chia?,"['procesamiento y/o forma de consumo, de corresponder.”\nArtículo 918 - (Resolución Conjunta SPReI N° 169/2013 y SAGyP N° 230/2013)\n“Con la denominación de semillas de chía se entienden las semillas sanas, limpias y bien\nconservadas de Salvia hispánica L.\nDeberán cumplir con las siguientes especificaciones:\nLas semillas de chía, que respondan a la especie mencionada, serán de color marrón oscuro, de\ntamaño muy pequeño y de buena fluidez.\nEl aroma deberá ser suave, agradable y propio de la semilla.\nAgua a 100 – 105 ºC: máximo 7%\nMateria grasa: mínimo 33%.\nNo deberán contener más de 0,5% de semillas dañadas.\nEstarán libres de insectos vivos.\nNo deberán contener más de 1% de materias extrañas, de las cuales no más de 0,25% será de\nmaterial mineral y no más de 0,10% de insectos muertos, fragmentos o restos de insectos y/u\notras impurezas de origen animal.\nSe entiende por materias extrañas a la materia mineral u orgánica (polvo, ramitas,\ntegumentos, semillas de otras especies, insectos muertos, fragmentos o restos de insectos y\notras impurezas de origen animal).”\nArtículo 919 - (Resolución Conjunta SPReI N° 169/2013 y SAGyP N° 230/2013)\n“Con el nombre de girasol se entiende las semillas con cáscara o peladas, limpias de Helianthus\nannus L.”\nArtículo 920 - (Resolución Conjunta SPReI N° 169/2013 y SAGyP N° 230/2013)\n“Con los nombres de maní o cacahuete, se entienden las vainas de Arachis hypogaea L. y\ntambién las semillas sanas crudas o tostadas del mismo, peladas o cubiertas con su\ntegumento.”\nArtículo 921 - (Resolución Conjunta SPReI N° 169/2013 y SAGyP N° 230/2013)\n“Con el nombre de piñones, se entienden las semillas peladas y limpias del fruto o piña madura\ndel pino piñonero Pinus pinea L. y de otras especies como el pehuén Pinus araucano Mob.,\nAraucaria angustifolia y Araucaria araucana.”\nArtículo 922 - (Resolución Conjunta SPReI N° 169/2013 y SAGyP N° 230/2013)\n“Con la denominación de sésamo o semillas de ajonjolí, se entienden las correspondientes del\nSesamum indicum L, S. orientale L, S. radiatum L, de la familia Pedaliaceae.\nPodrán presentarse de distintos colores: blancas, amarillas, rojizas, morenas o negras; de\ntamaño pequeño, planas, alargadas en forma de espátula.\nSu composición química será:\nHumedad a 100-105° C: máximo 8,7%\nPrótidos totales: mínimo 17,0%\nSubstancias grasas: mínimo 35,0%\nCenizas a 500-550° C: máximo: 9,5%\nEste producto se rotulará: Semillas de Sésamo o Semillas de Ajonjolí, pudiendo indicarse en el\nrótulo la variedad correspondiente.”\nArtículo 923 - (Resolución Conjunta SCS Y SB Nº10/2024)\nLas algas comestibles admitidas son las que se establecen en la presente tabla:\nOCHROPHYTA (ALGAS PARDAS)\nNOMBRE\nNOMBRE TAXONÓMICO PRESENTACIÓN\nCOMÚN\nDeshidratada;\nFucus Fucus vesiculosus L.\nfragmentada; molida\nAlga noruega; Deshidratada;\nAscophyllum nodosum Le Jolis\nalga nudosa; molida\nEspagueti de\nmar; Judía de Himanthalia elongata Encurtido\nmar\nDeshidratada,\nHijiki Sargassum fusiforme (Harv.)Setchell\nfragmentada\nDeshidratada;\nCochayuyo Durvillea antarctica (Cham.) Har\nentera', 'visible deberá figurar: peso neto y año de elaboración.\nC - Tipo Alemana: Elaborada con harina de Brassica nigra, B. juncea, Sinapis alba o sus\nmezclas; vinagre, cloruro de sodio, especias, debiendo contener ajo y cebolla; cerveza.\nPresentará una puntuación más o menos fina por las especias molidas y responderá a la\ncomposición establecida en el presente.\nEste producto se rotulará: Mostaza en pasta o Mostaza de mesa, con caracteres de igual\ntamaño, realce y visibilidad. Inmediatamente por debajo de la denominación y con caracteres\nde menor tamaño se consignará la leyenda Tipo Alemana.\nCon caracteres y en lugar bien visible deberá figurar: peso neto y año de elaboración"".\nArtículo 1286\nSe entiende por Mostaza o Mostarda de Cremona, el condimento preparado con frutas u\nhortalizas cándidas o no, puestas en un jarabe de azúcar o dextrosa que contiene harina de\nmostaza, aromas y otras sustancias de uso permitido.\nArtículo 1287\nSe entiende por Chimichurri o Adobo Criollo, el aliño más o menos espeso elaborado a base de\nvinagre; con o sin ácido tártrico o cítrico; sal, laurel, albahaca, orégano, ají u otros\ncondimentos molidos en partículas más o menos finas.\nArtículo 1288\nSe entiende por Salsa de anchoas, la preparada a base de pasta de anchoas, sal, vinagre,\ncerveza, con diversos condimentos (ají, orégano, albahaca, etc) envasados y tratados en forma\nconveniente.\nArtículo 1289\nSe entiende por Salsa tártara, el producto elaborado a base de mayonesa, con adición de\nmostaza, huevos duros picados, alcaparras y pepinos en trozos pequeños, envasados en\nrecipientes adecuados.\nArtículo 1290\nSuprimido por Resolución Conjunta SRYGS y SAB Nº33/2019\nArtículo 1291\nSe entiende por Salsa criolla, el producto elaborado a base de cebolla, tomate, ají verde, ajo,\nperejil, perfectamente sanos y limpios, cortados en trozos finos, con agregado de sal, pimienta,\naceite, con o sin otros condimentos y vinagre en cantidad suficiente para el que el producto\nterminado presente un pH inferior a 4,5.\nEnvasado y tratado en forma conveniente para evitar su alteración.\nSUSTANCIAS AMARGAS\nArtículo 1292\nCon la denominación genérica de Sustancias amargas, se entienden los vegetales no nocivos, o\nsus extractos o principios activos a los que se les atribuye propiedades aperitivas.\nArtículo 1293 - Resolución Conjunta SCS y SAByDR N°33/2021\nSe consideran sustancias amargas nocivas y por lo tanto prohibidas para uso en la industria\nalimentaria:\n1. Las que contienen alcaloides: Adormidera (Papaver spp), Belladona (Atropa belladona L.),\nCebadilla, Coca (Erythroxylum coca), Estramonio (Datura spp), Habas de San Ignacio\n(Strychnos spp), Nuez vómica (Strychnos nuxvomica), etcétera.\n2. Las que contengan principios irritantes, drásticos o purgantes: Cantáridas, Coca de Levante\n(Anamirta cocculus L.), Coloquíntida (Citrullus colocynthis Schrad L.), Granos de paraíso (Melia\nazerdarach L.), excepto en los casos expresamente permitidos en el presente Código\nArtículo 1294 - Resolución Conjunta SCS y SAByDR N°33/2021', 'Productos\tPorción\n(g/ml)\tMedidas Caseras\n\tNone\t\nAlbóndigas a base de\t80\tX unidades que corresponda\ncarnes.\tNone\t\nAnchoas en conserva.\t15\t1 cuchara de sopa\nJamonada, Corned Beef.\t30\t1 rebanada\nAtún, sardina, caballa, y\t60\t3 cucharas de\notros pescados\tNone\tsopa/unidad que\ncon o sin salsas.\tNone\tcorresponda\n\tNone\t\nCaviar.\t10\t1 cuchara de té\nCharqui, charque, tasajo.\t30\tX fracciones de plato que\n\tNone\tcorresponda\nHamburguesas a base de\t80\tX unidades que corresponda\ncarnes.\tNone\t\nChorizos, salchichas, todos\t50\tX unidades/fracción que\nlos tipos.\tNone\tcorresponda\nDerivados del Surimi.\t20\tX unidades o cucharas que\n\tNone\tcorresponda\nPreparaciones de carnes\t100\tX unidades que\ncondimentadas,\tNone\tcorresponda\nahumadas, cocidas o no.\tNone\t\n\tNone\tNone\nPreparaciones de carnes con\t130\tX unidades que\nharinas o\tNone\tcorresponda\nrebozadas.\tNone\t\n\tNone\tNone\nEmbutidos, fiambres.\t40\tX unidades/feta que\n\tNone\tcorresponda\nBlanco de pavita.\t60\tX unidades/feta que\n\tNone\tcorresponda\nPatés (jamón, hígado,\t10\t1 cuchara de té\npanceta, etcétera).\tNone\t\nHuevo.\tX gramos que\ncorresponda\t1 unidad\n\tNone\t']","La harina de chía debe tener las siguientes características según el contexto proporcionado:
- Debe ser de color marrón oscuro.
- Tamaño muy pequeño y de buena fluidez.
- Aroma suave, agradable y propio de la semilla.
- Contenido de agua máximo de 7%.
- Contenido mínimo de materia grasa del 33%.
- No debe contener más de 0,5% de semillas dañadas.
- Libre de insectos vivos.
- Contenido máximo de materias extrañas del 1%, de las cuales no más de 0,25% será de material mineral y no más de 0,10% de insectos muertos, fragmentos o restos de insectos y/u otras impurezas de origen animal.","“Con la denominación de Harina de Chía, se entiende el producto proveniente de la
molienda de la semilla de chía (Salvia hispana L.) debiendo presentar esta última,
características de semillas sanas, limpias y bien conservadas, que han sido sometidas a
prensado para la remoción parcial o prácticamente total del aceite que contienen.
Los diversos tipos de Harina de Chía que se consideran responderán a las siguientes
características:
Harina de Chía
Parcialmente Desgrasada Desgrasada
Por ciento
Humedad (100 -105º C) máx. 9 5
Proteína (N x 6.25) mín. 20 29
Grasa (extracto etéreo) máx. 18 7
Fibra Total máx. 35 52
Cenizas (500 - 550º C) máx. 5 6
Granulometría: 0.5 - 1 mm.
Color: marrón grisáceo.
Sabor y aroma: suave, agradable, propio de la semilla.
Los límites máximos de tolerancia de contaminantes inorgánicos serán los establecidos en el
presente Código.
Criterios microbiológicos:
Coliformes Totales, máx. 100 UFC/g
Coliformes Fecales (E. coli) Ausencia en 1g
Salmonella sp. Ausencia en 25g
Clostridium, sp. (Sulfito reductores) Ausencia en 1g
Staphilococcus sp. Ausencia en 1g
Recuento total de hongos y levaduras, máx. 100 UFC/g
Aflatoxinas máx. 0,03 μg/kg
La denominación de venta será Harina de Chía Desgrasada o Harina de Chía Parcialmente
Desgrasada, según corresponda.”",0.9999999999666667,0.0,0.8952402407251517,1.0,Basic
¿Qué caracteristicas debe tener la harina de chia?,"['La harina de chía debe tener un tamaño de grano menor de 8 mm para considerarse pequeña, entre 8 y 10 mm para ser de tamaño mediano, y mayor de 10 mm para ser considerada grande.', 'La harina de chía debe tener una humedad máxima de 14,5 g/100g y un contenido de cenizas entre 1,35-2,00 g/100g para ser considerada de primera calidad.', 'La harina de chía debe tener las siguientes características:\n- Humedad máxima de 9%.\n- Contener un mínimo de 20% de proteína (N x 6.25) si es parcialmente desgrasada, y un mínimo de 29% si es desgrasada.\n- Contener como máximo 18% de grasa (extracto etéreo) si es parcialmente desgrasada, y como máximo 7% si es desgrasada.\n- Contener como máximo 35% de fibra total si es parcialmente desgrasada, y como máximo 52% si es desgrasada.\n- Contener como máximo 5% de cenizas (500 - 550º C) si es parcialmente desgrasada, y como máximo 6% si es desgrasada.\n- Tener una granulometría de 0.5 - 1 mm.\n- Presentar un color marrón grisáceo.\n- Tener un sabor y aroma suave y agradable, propio de la semilla.\n- Cumplir con criterios microbiológicos específicos, como la ausencia de Salmonella sp. en 25g y un recuento total de hongos y levaduras máximo de 100 UFC/g.\n- Los límites máximos de tolerancia de contaminantes inorgánicos deben ser los establecidos en el código correspondiente.']","La harina de chía debe tener las siguientes características para considerarse de buena calidad:
- Humedad máxima de 9%.
- Contener un mínimo de 20% de proteína (N x 6.25) si es parcialmente desgrasada, y un mínimo de 29% si es desgrasada.
- Contener como máximo 18% de grasa (extracto etéreo) si es parcialmente desgrasada, y como máximo 7% si es desgrasada.
- Contener como máximo 35% de fibra total si es parcialmente desgrasada, y como máximo 52% si es desgrasada.
- Contener como máximo 5% de cenizas (500 - 550º C) si es parcialmente desgrasada, y como máximo 6% si es desgrasada.
- Tener una granulometría de 0.5 - 1 mm.
- Presentar un color marrón grisáceo.
- Tener un sabor y aroma suave y agradable, propio de la semilla.
- Cumplir con criterios microbiológicos específicos, como la ausencia de Salmonella sp. en 25g y un recuento total de hongos y levaduras máximo de 100 UFC/g.
- Los límites máximos de tolerancia de contaminantes inorgánicos deben ser los establecidos en el código correspondiente.","“Con la denominación de Harina de Chía, se entiende el producto proveniente de la
molienda de la semilla de chía (Salvia hispana L.) debiendo presentar esta última,
características de semillas sanas, limpias y bien conservadas, que han sido sometidas a
prensado para la remoción parcial o prácticamente total del aceite que contienen.
Los diversos tipos de Harina de Chía que se consideran responderán a las siguientes
características:
Harina de Chía
Parcialmente Desgrasada Desgrasada
Por ciento
Humedad (100 -105º C) máx. 9 5
Proteína (N x 6.25) mín. 20 29
Grasa (extracto etéreo) máx. 18 7
Fibra Total máx. 35 52
Cenizas (500 - 550º C) máx. 5 6
Granulometría: 0.5 - 1 mm.
Color: marrón grisáceo.
Sabor y aroma: suave, agradable, propio de la semilla.
Los límites máximos de tolerancia de contaminantes inorgánicos serán los establecidos en el
presente Código.
Criterios microbiológicos:
Coliformes Totales, máx. 100 UFC/g
Coliformes Fecales (E. coli) Ausencia en 1g
Salmonella sp. Ausencia en 25g
Clostridium, sp. (Sulfito reductores) Ausencia en 1g
Staphilococcus sp. Ausencia en 1g
Recuento total de hongos y levaduras, máx. 100 UFC/g
Aflatoxinas máx. 0,03 μg/kg
La denominación de venta será Harina de Chía Desgrasada o Harina de Chía Parcialmente
Desgrasada, según corresponda.”",0.9999999999666667,1.0,0.9067899636493578,0.6842105263157895,Advanced
¿Quiénes deben cumplir con la regulación alimentaria?,"['cumplan con lo establecido en el presente Reglamento estos no deberán ser visibles en el\nrótulo.\n4.1.2. Los términos en inglés autorizados para los respectivos idiomas en los ítems 4.2. y 4.3\ndel presente Reglamento no necesitan ser traducidos.\n4.2. Términos autorizados para las INC relativas al contenido de nutrientes (contenido\nabsoluto), siempre que se cumplan los requerimientos establecidos en el ítem 5.1.\nATRIBUTO TÉRMINOS AUTORIZADOS\nEspañol: Bajo…, leve…, ligero…, pobre…, liviano…\nBajo\nPortugués: Baixo em..., pouco... baixo teor de..., leve em....\nNo contiene Español: No contiene, libre de…, cero (0 o 0%)…, sin…, exento de… , no\naporta..., free…, zero…\nPortugués: Não contém, livre de…, zero (0 ou 0%)…, sem..., isento de…\nAlto contenido Español: Alto contenido, rico en…, alto tenor….\nPortugués: Alto conteúdo, rico em…, alto teor…\nFuente Español: Fuente de…, con…, contiene...\nPortugués: Fonte de…, com…, contém...\nMuy bajo Español: Muy bajo….\nPortugués: Muito baixo\nSin adición Español: Sin adición de…, sin…adicionado/a, sin agregado de…, sin\n….agregada/o\nPortugués: Sem adição de..., zero adição de..., sem .... adicionado\n4.3. Términos autorizados para la INC comparativas (contenido comparativo), siempre que\nse cumplan los requerimientos establecidos en el ítem 5.2.\nATRIBUTO TÉRMINOS AUTORIZADOS\nReducido Español: Reducido en…., …menos de…, menor contenido de…, menos…,\n… menos que…, light...\nPortugués: Reduzido em…, menos…, menor teor de…, light…\nAumentado Español: Aumentado en…, …más de…, más…\nPortugués: Aumentado em…, mais…\n5. CONDICIONES PARA DECLARAR INFORMACIÓN NUTRICIONAL\nCOMPLEMENTARIA (DECLARACIONES DE PROPIEDADES NUTRICIONALES)\n5.1. CONTENIDO ABSOLUTO.\nVALOR ENERGÉTICO (*)\nATRIBUTO CONDICIONES\nPor 100 g o 100 ml en platos preparados según\nNo contiene más de corresponda\nBajo 40 kcal (170 kJ) Por porción cuando estas son mayores a 30 g o 30\nml. En porciones menores o iguales a 30 g o 30\nml se calculará en base a 50 g o 50 ml\nPor 100 g o 100 ml en platos preparados según\nNo contiene más de 4\nNo contiene corresponda\nkcal (17 kJ)\nPor porción\n(*) Para estos atributos pueden ser utilizados, opcionalmente, los términos “Calorías”,\n“kilocalorías” o “kcal” como equivalentes al término “valor energético”.\nAZÚCARES (*)\nATRIBUTO CONDICIONES\nNo contiene más Por 100 g o 100 ml en platos preparados según\nde 5 g de corresponda\nazúcares. Por porción cuando estas son mayores a 30 g o 30 ml. En\nporciones menores o iguales a 30g o 30 ml se calculará en\nbase a 50 g o 50 ml\nBajo Si el alimento no cumple con las condiciones exigidas para el atributo ""bajo o\nreducido en valor energético"" deberá consignar en el rótulo junto a la INC la\nfrase ""Este no es un alimento bajo o reducido en valor energético”, según\ncorresponda, con los mismos caracteres en cuanto al tipo de letra de la INC, de\npor lo menos 50% del tamaño de la INC, de color contrastante al fondo del\nrótulo y que garantice la visibilidad y legibilidad de la información.\nPor 100 g o 100 ml en platos preparados según\ncorresponda\nNo contiene más\nde 0,5 g de', 'e) cantidades recuperadas, detalles de disposición de productos recuperados y acta de\ndestrucción (en caso de corresponder);\nf) acciones correctivas y preventivas que fueron diseñadas para evitar que el incidente se\nrepita en el futuro.\n3.3.4 Obligaciones de las AS en esta etapa\nLas ASP y la Ciudad Autónoma de Buenos Aires deberán:\n- realizar el seguimiento y la recopilación de información sobre el recupero en su\njurisdicción.\n- asesorar a la empresa acerca de cómo disponer los alimentos recuperados\n- supervisar la disposición de los productos recuperados en su jurisdicción.\n- realizar la evaluación y revisión final del retiro de productos para determinar si el mismo\nse da por finalizado o si es necesario intensificar / modificar las acciones realizadas en su\njurisdicción.\n- dar por finalizado el retiro en su jurisdicción.\n- confeccionar el informe final de lo actuado en su jurisdicción.\n- notificar la finalización del retiro a la ASN y a todas las partes involucradas incluida la EA.\nLa ASN deberá:\n- realizar el seguimiento y la recopilación de información sobre el recupero a nivel nacional.\n- asesorar a la empresa acerca de cómo disponer los alimentos recuperados\n- supervisar la disposición y el destino de los productos importados recuperados en el país.\n- realizar la evaluación y revisión final del retiro de alimentos para determinar si el mismo\nse da por finalizado en el país o si es necesario intensificar / modificar las acciones\nrealizadas en alguna jurisdicción.\n- dar por finalizado el retiro a nivel país.\n- confeccionar el informe final de lo actuado en el país.\n- notificar la finalización del retiro a todas las partes involucradas incluida la EA.”\nArtículo 1416 – (Resolución Conjunta SPReI N° 27/2010 y SAGPyA N° 344/2010)\nLas Autoridades Sanitarias Competentes aplicarán para el muestreo las disposiciones que\nfiguran en el Anexo del presente artículo:\nANEXO\nOBJETIVO\nEstablecer un conjunto de instrucciones de muestreo con reglas para su aplicación.\nALCANCE\nTodos aquellos alimentos acondicionados para su venta incluidos en el Código Alimentario\nArgentino.\nQuedan exceptuados todos aquellos productos a los cuales se les haya definido un plan de\nmuestreo específico en la legislación vigente.\nINTRODUCCIÓN\nLa mayoría de los procedimientos de muestreo comprenden la selección de una o varias\nmuestras de un lote, la inspección o el análisis de las muestras y la clasificación del lote\n(como “aceptable” o “no aceptable”) a partir del resultado de la inspección o el análisis de la\nmuestra.\nUn plan de muestreo de aceptación es un conjunto de normas con arreglo a las cuales se\ninspecciona y clasifica un lote. El plan estipulará el número de elementos, que habrán de ser\nseleccionados de forma aleatoria en el lote objeto de inspección, que constituirán la\nmuestra.\nUn procedimiento de muestreo que incluya el “cambio” de plan de muestreo se denomina\n“esquema de muestreo”.\nUn conjunto de planes y esquemas de muestreo constituye un “sistema de muestreo”.']","Los establecimientos y empresas relacionadas con la producción, distribución y venta de alimentos deben cumplir con la regulación alimentaria. Esto incluye cumplir con las normativas establecidas en los reglamentos vigentes, como por ejemplo, la correcta declaración de información nutricional en los productos, el etiquetado adecuado, el cumplimiento de los estándares de calidad e higiene, entre otros requisitos establecidos por las autoridades competentes en materia de alimentos.","Artículo 1
Toda persona, firma comercial o establecimiento que elabore, fraccione, conserve, transporte,
expenda, exponga, importe o exporte alimentos, condimentos, bebidas o primeras materias
correspondientes a los mismos y aditivos alimentarios debe cumplir con las disposiciones del
presente Código.",0.99999999995,1.0,0.8423350143325542,1.0,Basic
¿Quiénes deben cumplir con la regulación alimentaria?,"['Los Estados Partes del MERCOSUR deben cumplir con la regulación alimentaria establecida en el ""Reglamento Técnico MERCOSUR de Identidad y Calidad de Leche en Polvo"", el cual fija la identidad y las características mínimas de calidad que deben cumplir la leche en polvo y la leche en polvo instantánea destinada al consumo humano, excluyendo aquella destinada a formulaciones para lactantes y farmacéuticas. Este reglamento se aplica al comercio entre los Estados Partes, a las importaciones extrazona y a la comercialización en el territorio de los Estados Partes del MERCOSUR. Los organismos nacionales competentes de los Estados Partes son responsables de implementar esta regulación.', 'Todos los autorizados como Buenas Prácticas de Fabricación (BPF) en el MERCOSUR deben cumplir con la regulación alimentaria.']","Aquellas personas o entidades que estén autorizadas como Buenas Prácticas de Fabricación (BPF) en el MERCOSUR deben cumplir con la regulación alimentaria. Además, los Estados Partes del MERCOSUR también deben cumplir con la regulación alimentaria establecida en los reglamentos técnicos correspondientes, como por ejemplo el ""Reglamento Técnico MERCOSUR de Identidad y Calidad de Leche en Polvo"" mencionado en el contexto.","Artículo 1
Toda persona, firma comercial o establecimiento que elabore, fraccione, conserve, transporte,
expenda, exponga, importe o exporte alimentos, condimentos, bebidas o primeras materias
correspondientes a los mismos y aditivos alimentarios debe cumplir con las disposiciones del
presente Código.",0.99999999995,1.0,0.8393681381157596,0.0,Advanced
¿Qué se define como aditivo alimentario?,"['Nº\nINS\nCode\nx\tNombre del Aditivo Alimentario\n(Español)\tNome do Aditivo Alimentar\n(Português)\tFunciones/Funçõe\ns', 'Nº\nINS\nCode\nx\tNombre del Aditivo Alimentario\n(Español)\tNome do Aditivo Alimentar\n(Português)\tFunciones/Funçõe\ns', 'Aditivo:\nNúmero\nINS\tAditivo:\nFUNCIÓN / Nombre\tAditivo:\nConcentración\nmáxima g/100g\n\tACIDULANTE\t', 'Aditivo:\nNúmero\nINS\tAditivo:\nFUNCIÓN / Nombre\tAditivo:\nConcentración\nmáxima g/100g', 'Un término definido en un párrafo cualquiera del presente Código tiene la misma significación\nen cualquiera otra parte en que se lo emplee.\nArtículo 6\nA los efectos de este Código se establecen las siguientes definiciones:\n1. Consumidor: Toda persona o grupo de personas o institución que se procure alimentos para\nconsumo propio o de terceros.\n2. Alimento: toda substancia o mezcla de substancias naturales o elaboradas que ingeridas por\nel hombre aporten a su organismo los materiales y la energía necesarios para el desarrollo de\nsus procesos biológicos. La designación ""alimento"" incluye además las substancias o mezclas\nde substancias que se ingieren por hábito, costumbres, o como coadyuvantes, tengan o no\nvalor nutritivo.\n3. Aditivo alimentario: Cualquier substancia o mezcla de substancias que directa o\nindirectamente modifiquen las características físicas, químicas o biológicas de un alimento, a\nlos efectos de su mejoramiento, preservación, o estabilización, siempre que:\na) Sean inocuos por sí mismos o a través de su acción como aditivos en las condiciones de\nuso.\nb) Su empleo se justifique por razones tecnológicas, sanitarias, nutricionales o\npsicosensoriales necesarias.\nc) Respondan a las exigencias de designación y de pureza que establezca este Código.\n4. Alimento genuino o normal: Se entiende el que, respondiendo a las especificaciones\nreglamentarias, no contenga sustancias no autorizadas ni agregados que configuren una\nadulteración y se expenda bajo la denominación y rotulados legales, sin indicaciones, signos o\ndibujos que puedan engañar respecto a su origen, naturaleza y calidad.\n5. (Res 205, 7.03.88) ""Alimento alterado: El que por causas naturales de índole física,\nquímica y/o biológica o derivadas de tratamientos tecnológicos inadecuados y/o deficientes,\naisladas o combinadas, ha sufrido deterioro en sus características organolépticas, en su\ncomposición intrínseca y/o en su valor nutritivo"".\n6. Alimento contaminado: el que contenga:\na) Agentes vivos (virus, microorganismos o parásitos riesgosos para la salud), sustancias\nquímicas, minerales u orgánicas extrañas a su composición normal sean o no repulsivas o\ntóxicas.\nb) Componentes naturales tóxicos en concentración mayor a las permitidas por exigencias\nreglamentarias.\n7. Alimento adulterado: El que ha sido privado, en forma parcial o total, de sus elementos\nútiles o característicos, reemplazándolos o no por otros inertes o extraños; que ha sido\nadicionado de aditivos no autorizados o sometidos a tratamientos de cualquier naturaleza para\ndisimular u ocultar alteraciones, deficiente calidad de materias primas o defectos de\nelaboración.\n8. Alimento falsificado: El que tenga la apariencia y caracteres generales de un producto\nlegítimo protegido o no por marca registrada, y se denomine como éste sin serlo o que no\nproceda de sus verdaderos fabricantes o zona de producción conocida y/o declarada.\nRESOLUCIÓN GMC Nº 031/92 y RESOLUCIÓN GMC N° 018/93\nIncorporadas por Resolución MSyAS N° 003 del 11.01.95', 'Definir el objeto de muestreo\t¿Qué tipo de alimento se va a muestrear?', '4.3. Acondicionamiento.\nDeberá ser envasado con materiales adecuados para las condiciones de almacenamiento\nprevistas y que confieran al producto una protección adecuada.\n5. ADITIVOS Y COADYUVANTES DE TECNOLOGÍA/ELABORACIÓN\n5.1. Aditivos.\nEn los Quesos Rallados se admitirá la presencia de los aditivos autorizados en el Reglamento\nTécnico General Mercosur de Identidad y Calidad de Quesos para el o los quesos utilizados como\nmateria prima y su concentración en el producto final deberá responder a los máximos\nautorizados en dicho Reglamento.\nSe admitirá además el uso de los aditivos que se indican a continuación no pudiendo superar las\nconcentraciones máximas indicadas en el producto final independientemente de la concentración\nde dichos aditivos en el o en los quesos utilizados como materia prima.\nADITIVO FUNCIÓN CONC.MAX.EN EL PRODUCTO FINAL\nAcido sórbico o sus sales de Conservador 1000 mg/kg solas o en combinación\nNa, K y Ca expresadas como ác. sórbico\nNatamicina Conservador 5 mg/kg\nCelulosa microcristalina Antiaglutinante b.p.f.\nDióxido de silicio Antiaglutinante 5g/kg\n5.2. Coadyuvantes de Tecnología/Elaboración.\nNitrógeno, Dióxido de Carbono y/o gases inertes en el envasado.\n6. CONTAMINANTES\nLos contaminantes orgánicos e inorgánicos no deben estar presentes en cantidades superiores a\nlos límites establecidos por el Reglamento Mercosur correspondiente.\n7. HIGIENE\n7.1. Consideraciones generales\nLas prácticas de higiene para la elaboración del producto estarán de acuerdo con lo que se\nestablece en el Código Internacional Recomendado de Prácticas, Principios Generales de Higiene\nde los Alimentos (CAC/Vol A 1985).\n7.2. Características distintivas del proceso de elaboración.\n7.2.1. Los quesos a utilizarse en la elaboración deberán ser previamente tratados para adecuarlos\nhigiénicamente al proceso de rallado.\n7.2.2. Los procesos de rallado, secado, acondicionamiento y envasado deberán responder a las\nbuenas prácticas de fabricación.\n7.2.3. En la elaboración de quesos rallados queda prohibida la utilización de quesos no aptos\npara el consumo humano. Sólo se admitirán los quesos no adecuados para la venta al público\ncomo tales debido a fallas morfológicas o de presentación comercial, siempre que no afecten la\ncalidad del producto terminado.\n7.3. Criterios macroscópicos y microscópicos: El producto no deberá contener sustancias\nextrañas macro y/o microscópicas de cualquier naturaleza.\n7.4. Criterios microbiológicos.\n7.4.1. Quesos rallados elaborados con una única variedad de queso (2.3.1).\n7.4.1.1. Variedad de Baja Humedad\nMICROORGANISMOS CRITERIO DE CATEGORÍA MÉTODO DE\nACEPTACIÓN ANÁLISIS\nColiformes/g (30°C) n=5 c=2 m=200 M=1000 5 FIL 73 A:1985\nColiformes (45°C) n=5 c=2 m=100 M=500 5 APHA 1992 Cap. 24\n(1)\nEstafilococos Coag. Pos/g n=5 c=2 m=100 M=1000 5 FIL 145:1990\nHongos y Levaduras n=5 c=2 m=500 M=5000 2 FIL 94B:1990\nSalmonella ssp/25 g n=5 c=0 m=0 10 FIL 93 A:1985\n7.4.1.2. Variedad de Mediana Humedad\nMICROORGANISMOS CRITERIO DE ACEPTACIÓN CATEGORÍA MÉTODO DE\nANÁLISIS', 'Toda “norma específica” a que se refieren las resoluciones anexas, serán únicamente aquellas\narmonizadas en el ámbito del MERCOSUR.\nSe deroga toda legislación del Código Alimentario Argentino que se oponga a la presente\nResolución.\nDEFINICIÓN Y PRINCIPIOS FUNDAMENTALES REFERENTE A EMPLEO DE\nADITIVOS, INGREDIENTES, COADYUVANTE DE ELABORACIÓN,\nCONTAMINANTES.\nArt 1° - Aprobar las definiciones de ingrediente, aditivo alimenticio, coadyuvante de\nelaboración, contaminante y los principios fundamentales referentes al empleo de aditivos\nalimenticios, conforme a lo siguiente:\nIngredientes: es toda sustancia, incluidos los aditivos alimentarios, que se emplee en la\nfabricación o preparación de un alimento y esté presente en el producto final en su forma\noriginal o modificada.\nAditivo alimentario: es cualquier ingrediente agregado a los alimentos intencionalmente, sin\nel propósito de nutrir, con el objeto de modificar las características físicas, químicas, biológicas\no sensoriales, durante la manufactura, procesado, preparación, tratamiento, envasado,\nacondicionado, almacenado, transporte o manipulación de un alimento; podrá resultar que el\npropio aditivo o sus derivados se conviertan en un componente de dicho alimento. Esta\ndefinición no incluye a los contaminantes o a las sustancias nutritivas que se incorporan a un\nalimento para mantener o mejorar sus propiedades nutricionales.\nRESOLUCIÓN GMC N° 18/93 Sustitúyase el texto de la definición de Coadyudante de\nElaboración de productos alimentarios incluidos en el artículo 1º de la Resolución GMC Nº\n31/92 por el siguiente:\nCoadyuvante de Tecnología es toda sustancia, excluyendo los equipamientos y los\nutensilios, que no se consume por si sola como ingrediente alimenticio y que se emplea\nintencionalmente en la elaboración de materias primas, alimentos o sus ingredientes, para\nobtener una finalidad tecnológica durante el tratamiento o elaboración. Deberá ser eliminado\ndel alimento o inactivado, pudiendo admitirse la presencia de trazas de la sustancia, o sus\nderivados, en el producto final.\nContaminante: es cualquier sustancia indeseable presente en el alimento en el momento del\nconsumo, provenientes de las operaciones efectuadas en el cultivo de vegetales, cría de\nanimales, tratamientos zoo o fitosanitarios, o como resultado de la contaminación del\nambiente, o de los equipos de elaboración y/o conservación.\nPrincipios fundamentales referentes al empleo de aditivos alimentarios.\nA) La seguridad de los aditivos es primordial, esto supone que antes de autorizar el uso de\nun aditivo en alimentos deberá haberse sometido a una adecuada evaluación toxicológica en\nla que se deberá tener en cuenta, entre otros aspectos, cualquier efecto acumulativo,\nsinérgico o de protección producida por su uso; los aditivos alimentarios deberán\nmantenerse en observación y revaluarse cuando sea necesario si cambian las condiciones de\nuso, debiéndose estar al tanto de las informaciones científicas que aparezcan sobre este\ntema;', '\n(*) Cuando para una determinada función se autoricen dos o más aditivos con\nconcentración máxima numérica asignada, la suma de las cantidades a utilizar en un\nalimento no podrá ser superior a la cantidad máxima correspondiente al aditivo permitido\nen mayor cantidad y la cantidad de cada aditivo no podrá ser superior a su límite\nindividual. Cuando un aditivo tenga dos o más funciones asignadas para un mismo\nalimento, la cantidad a utilizar en ese alimento no podrá ser superior a la cantidad\nindicada en la función en la que se le asigna mayor concentración.\n(*) Quando para uma determinada função são autorizados dois ou mais aditivos com\nlimite Máximo numérico estabelecido, a soma das quantidades a serem utilizadas no\nalimento não pode ser superior a quantidade máxima correspondente ao aditivo\npermitido em maior quantidade, e a quantidade de cada aditivo não poderá ser superior\nao seu limite individual. Se um aditivo apresentar duas ou mais funções permitidas para\no mesmo alimento, a quantidade a ser utilizada neste alimento não poderá ser superior a\nquantidade indicada na função em que o aditivo é permitido em maior concentração.', 'B) La restricción de uso de los aditivos, establece que el uso deberá limitarse a alimentos\nespecíficos, en condiciones específicas y al nivel mínimo para lograr el efecto deseado;\nC) La necesidad tecnológica de uso de un aditivo solo será justificado cuando proporciona\nventajas de orden tecnológico y no cuando estas puedan ser alcanzadas por operaciones de\nfabricación más adecuadas o por mayores precauciones de orden higiénico u operacional.\nD) El empleo de aditivos se justifica por razones tecnológicas, sanitarias, nutricionales o\npsico-sensoriales, siempre que:\ni) Se empleen aditivos autorizados en concentraciones tales que su ingesta diaria no\nsupere los valores admitidos;\nii) Responda a las exigencias de pureza establecidas por FAO-OMS, o por el FOOD\nCHEMICAL CODEX.\nArtículo 6bis - (Res 49, 27.1.86)\n""Queda terminantemente prohibida la tenencia, circulación y venta de alimentos y sus primeras\nmaterias, alterados, contaminados, adulterados, falsificados y/o falsamente rotulados bajo\npena de multa, prohibición de venta y comiso de la mercadería en infracción"".\nArtículo 7\nCon la expresión intoxicación por alimentos, se entiende los procesos patológicos, originados\nno sólo por alimentos alterados, sino también por la ingestión de productos que, a pesar de\npresentar apariencia normal, contienen elementos o substancias nocivas para el organismo,\ncualquiera sea su origen.\nArtículo 8\nQueda prohibido adicionar a los alimentos substancias o ingredientes (aditivos) que no estén\nexpresamente admitidos para cada caso por el presente Código.\nDeberán agregarse en el momento de la elaboración o preparación del alimento, en la\nproporción necesaria para el fin propuesto y admitido, pero no podrán adicionarse con\nposterioridad, para disimular, atenuar o corregir deficiencias de fabricación, de manipulación o\nde conservación.\nArtículo 9\nLos alimentos elaborados en el país, imitando productos extranjeros, deberán serlo de acuerdo\ncon los procedimientos del lugar de origen y responderán a las características propias de los\ntipos originales (Vinos: Oporto, Málaga, Marsala, etc; Quesos: Roquefort, Gruyere, etc).\nArtículo 10\nLas disposiciones del presente Código rigen para los alimentos destinados al consumo dentro\ndel país, pudiendo adicionarse substancias no autorizadas a los productos alimenticios o\nbebidas elaborados para la exportación, siempre que el interesado demuestre que ellas son\npermitidas en el país de destino.\nArtículo 11\nToda mercadería que se venda debe ser de la misma calidad que la que se exhiba y en caso de\nproductos no homogéneos en tamaño, forma o color, que signifiquen distinta calidad, deben\nexponerse a la venta en forma tal que el adquirente no pueda ser inducido a error respecto a\nlas características de la mercadería que compra.', 'Aditivo:\nNúmero\nINS\tAditivo:\nFUNCIÓN / Nombre\tAditivo:\nConcentración\nmáxima g/100g\n\tANTIHUMECTANTE/ANTIAGLUTINANTE\t\nTodos los autorizados como BPF por el presente Código\tNone\tquantum satis\n\tAROMATIZANTE/SABORIZANTE\t\nTodos los autorizados por el presente Código (excepto los que\nimitan aroma/sabor a cacao o chocolate)\tNone\tquantum satis\n\tEMULSIONANTE\t\nTodos los autorizados como BPF por el presente Código\tNone\tquantum satis\n442\tSales de Amonio de Ácidos Fosfatídicos\t1,0', 'Aditivo:\nNúmero\nINS\tAditivo:\nFUNCIÓN / Nombre\tAditivo:\nConcentración\nmáxima g/100g\n\tANTIHUMECTANTE/ANTIAGLUTINANTE\t\nTodos los autorizados como BPF por el presente Código\tNone\tquantum satis\n\tAROMATIZANTE/SABORIZANTE\t\nTodos los autorizados por el presente Código (excepto los que\nimitan aroma/sabor a cacao o chocolate)\tNone\tquantum satis\n\tEMULSIONANTE\t\nTodos los autorizados como BPF por el presente Código\tNone\tquantum satis\n442\tSales de Amonio de Ácidos Fosfatídicos\t1,0', 'mismos aditivos, excepto los conservadores, para cada función en cantidades tales que el\nproducto listo para consumo contenga como máximo las concentraciones establecidas para\nla categoría 16.2.2.1. Se admite también el uso de Antiaglutinantes/Antihumectantes y de\nun humectante adicional en cantidades tales que el producto listo para el consumo\ncontenga como máximo las concentraciones que se indican a continuación:\nAdmitem-se as mesmas funções, exceto a função conservador, que para 16.2.2.1 , e os\nmesmos aditivos, exceto os conservadores, para cada função em quantidades tais que o\nproduto pronto para o consumo contenha no máximo os limites estabelecidos para a\ncategoria 16.2.2.1 Admite-se também o uso de antiaglutinante/antiumectantess e de um\numectante adicional, em quantidades tais que no produto pronto para consumo contenha\nno máximo os limites estabelecidos, como se indica a seguir:\nANTIAGLUTINANTE/ ANTIAGLUTINANTE /\nANTIHUMECTANTE ANTIUMECTANTE\nTodos los autorizados Todos os autorizados como BPF\ncomo BPF en no MERCOSUL quantum satis\nMERCOSUR\n341iii Calcio-(tri) Fosfato, Fosfato tricálcico, fosfato\nCalcio Fosfato Tribásico, tribásico de cálcio, fosfato de\n0,07 (como P O )\nCalcio-(tri) Ortofosfato cálcio tribásico, fosfato de cálcio 2 5\nprecipitado, fosfato de cálcio\nHUMECTANTE UMECTANTE\n480 Dioctil sulfossuccinato Dioctil sulfossuccinato de sódio\n0,001\nde sódio\n(*) Cuando para una determinada función se autoricen dos o más aditivos con\nconcentración máxima numérica asignada, la suma de las cantidades a utilizar en un\nalimento no podrá ser superior a la cantidad máxima correspondiente al aditivo permitido\nen mayor cantidad y la cantidad de cada aditivo no podrá ser superior a su límite\nindividual. Cuando un aditivo tenga dos o más funciones asignadas para un mismo\nalimento, la cantidad a utilizar en ese alimento no podrá ser superior a la cantidad\nindicada en la función en la que se le asigna mayor concentración.\n(*) Quando para uma determinada função são autorizados dois ou mais aditivos com\nlimite Máximo numérico estabelecido, a soma das quantidades a serem utilizadas no\nalimento não pode ser superior a quantidade máxima correspondente ao aditivo\npermitido em maior quantidade, e a quantidade de cada aditivo não poderá ser superior\nao seu limite individual. Se um aditivo apresentar duas ou mais funções permitidas para\no mesmo alimento, a quantidade a ser utilizada neste alimento não poderá ser superior a\nquantidade indicada na função em que o aditivo é permitido em maior concentração.\nModificado por RESOLUCIÓN GMC N° 34/07 (Incorporada por Resolución Conjunta\nSPReI y SAGPyA N°178/2008 y N° 394/2008): “Prohíbese el uso en alimentos de los\naditivos INS 216 Propil parahidroxibenzoato (propilparabeno) y INS 217 Sodio propil para-\nhidroxibenzoato (sodio propilparabeno).”\nPREPARADO VEGETAL BEBIBLE\nArtículo 1010 - (Resolución Conjunta SB y SCS N° 1/2024)\n[Se otorga a las empresas un plazo de DIECIOCHO (18) meses, a partir del 30 de\nabril de 2024, para su adecuación].', 'superior a la cantidad máxima correspondiente al aditivo permitido en mayor cantidad y la\ncantidad de cada aditivo no podrá ser superior a su límite individual. Cuando un aditivo tenga\ndos o más funciones asignadas para un mismo alimento, la cantidad a utilizar en ese alimento\nno podrá ser superior a la cantidad indicada en la función en la que se le asigna mayor\nconcentración.\n(*) Quando para uma determinada função são autorizados dois ou mais aditivos com limite\nmáximo numérico estabelecido, a soma das quantidades a serem utilizadas no alimento não\npode ser superior à quantidade máxima correspondente ao aditivo permitido em maior\nquantidade, e a quantidade de cada aditivo não poderá ser superior ao seu limite individual. Se\num aditivo apresentar duas ou mais funções permitidas para o mesmo alimento, a quantidade\na ser utilizada neste alimento não poderá ser superior à quantidade indicada na função em que\no aditivo é permitido em maior concentração.\nArtículo 647 - (Res. 1547, 12.09.90)\n""Se entiende por Arroz entero o Arroz integral el grano de Oryza sativa L. descascarado, con\npericarpio, duro, seco, libre de impurezas y parásitos.\nPodrá contener como máximo: 14,0% de humedad y 1,2% de cenizas (500°-550°C).\nEste producto se rotulará en el cuerpo del envase:\nArroz integral,\ncon caracteres de igual tamaño, realce y visibilidad y se consignará con caracteres bien visibles\nel nombre del tipo al que pertenece"".\nArtículo 648 - (Res. 1547, 12.09.90)\n""Los distintos productos derivados del arroz deberán responder a las definiciones consignadas a\ncontinuación. Su denominación deberá figurar en el cuerpo del envase con caracteres de igual\ntamaño, realce y visibilidad, junto al Tipo (Artículo 649) y Calidad (Artículo 651) que\ncorresponda.\na) Arroz pulido o Arroz blanco: es el grano sin pericarpio.\nb) Arroz perlado o Arroz glaseado (Glasé): es el que se presenta sin pericarpio ni aleurona, que\nse abrillanta por fricción con aceite, glucosa y/o talco.\nc) Arroz quebrado: es el que presenta el grano partido en cualquier sentido, siempre que tenga\nun tamaño mayor al 50% del grano entero y que cumpla con las normas de ""Segunda Calidad""\nrespecto a porcentajes de granos defectuosos (excepto granos fragmentados).\nEn el rótulo se indicará el tipo al que corresponde.\nd) Arrocín o Arrozín: es el producto constituido por fragmentos de tamaño menor del 50% del\ngrano entero y la harina que se separa durante el pulido o abrillantado.\nLos productos derivados del arroz podrán contener como máximo 14,0% de humedad y 0,60%\nde cenizas (500-550°C).\nNo deberá contener más de 0,04% de dióxido de azufre, 0,50% de talco y 0,10% de semillas\ny/o cuerpos extraños"".\nArtículo 649 - (Res. 1547, 12.09.90)\n""El arroz se clasificará de acuerdo con sus características morfológicas en los siguientes tipos:\na) Tipo Largo Ancho (Doble Carolina):\nCorresponde a los granos de arroz cuya relación largo ancho es mayor a 2:1 y menor a 3:1\ncuya longitud media es igual o mayor a 7 mm (similares a la variedad Fortuna).\nb) Tipo Largo Fino:', 'Aditivo:\nNúmero\nINS\tAditivo:\nFUNCIÓN / Nombre\tAditivo:\nConcentración\nmáxima g/100g\n\tACIDULANTE\t\n330\tÁcido Cítrico\tquantum satis\n334\tÁcido Tartárico\t0,5\n\tESTABILIZANTE\t\n407\tCarragenina (incluye Furcellaran y sus sales de Na\ny K ), Musgo Irlandés\tquantum satis\n\tEMULSIONANTE\t', 'Aditivo:\nNúmero\nINS\tAditivo:\nFUNCIÓN / Nombre\tAditivo:\nConcentración\nmáxima g/100g\n\tREGULADOR DE ACIDEZ\t\nTodos los autorizados como BPF por el presente Código\tNone\tquantum satis\n334\tÁcido Tartárico\t0,5\n335 i\tSodio (mono) tartrato\t0,5\n335 ii\tSodio (di) tartrato\t0,5', 'Aditivo:\nFUNCIÓN / Nombre\tAditivo:\nConcentración\nmáxima\ng/100g', 'CAPÍTULO XVIII\nADITIVOS ALIMENTARIOS\nArtículo 1391\nLos Aditivos Alimentarios, definidos en el Artículo 6°, Inc 3, del presente Código\ndeben:\na) Ser inocuos por sí o a través de su acción como aditivos en las condiciones de uso.\nb) Formar parte de la lista positiva de aditivos alimentarios del presente Código.\nc) Ser empleados exclusivamente en los alimentos específicamente mencionados en\neste Código.\nd) Responder a las exigencias de designación, composición, identificación y pureza que\neste Código establece.\n(ver Capítulo I del CAA RESOLUCIONES GMC Nº 031/92 Y N° 018/93\nIncorporadas por Resolución MSyAS N° 003 del 11.01.95)\nArtículo 1392\nLos aditivos alimentarios que cumplan las exigencias que este Código establece,\npodrán agregarse a los alimentos para:\na) Mantener o mejorar el valor nutritivo.\nb) Aumentar la estabilidad o capacidad de conservación.\nc) Incrementar la aceptabilidad de alimentos sanos y genuinos, pero faltos de\natractivo.\nd) Permitir la elaboración económica y en gran escala de alimentos de composición y\ncalidad constante en función del tiempo.\nArtículo 1393\nLos aditivos alimentarios no deben agregarse a los alimentos para:\na) Enmascarar técnicas y procesos defectuosos de elaboración y/o de manipulación.\nb) Provocar una reducción considerable del valor mu tritio de los alimentos.\nc) Perseguir finalidades que pueden lograrse con prácticas lícitas de fabricación,\neconómicamente factibles.\nd) Engañar al consumidor.\nArtículo 1394\nLa cantidad de un aditivo autorizado agregado a un producto alimenticio será siempre\nla mínima necesaria para lograr el efecto lícito deseado.\nSe establece atendiendo debidamente:\na) El nivel de consumo estimado del alimento o alimentos para los cuales se propone el\naditivo.\nb) Los niveles mínimos que en estudios sobre animales producen desviaciones\nimportantes respecto del comportamiento fisiológico normal.\nc) El suficiente margen de garantía para reducir al mínimo todo peligro para la salud\nen todos los grupos de consumidores.\nArtículo 1395 - (Res 1546, 12.09.90)\nLos aditivos alimentarios se expenderán siempre en envases originales cerrados.\nEn el rotulado inmediatamente por debajo de la denominación, deberá figurar la\nleyenda Uso Industrial exclusivo con caracteres de tamaño no menor al 50% de la\ndenominación del aditivo y de buen realce y visibilidad.\nLos aditivos alimentarios de uso permitido que se encuentren en todo establecimiento\nproductor de alimentos, deberán mantenerse en sus envases originales debidamente\ncerrados, a fin de evitar toda manipulación o riesgo de contaminación o mezcla con\nsustancias o productos de cualquier naturaleza.\nArtículo 1395 bis – (Resolución Conjunta SPyRS y SAGPyA N° 33/2007 y N°\n61/2007)\n""Todo establecimiento que elabore, fraccione o mezcle aditivos para su\ncomercialización, deberá contar con la Dirección Técnica de un profesional universitario\nque por la naturaleza de sus estudios a juicio de la autoridad sanitaria competente,\nesté capacitado para dichas funciones, quien además asumirá conjuntamente con la', 'empresa la responsabilidad ante las autoridades sanitarias de la calidad de los\nproductos elaborados.\nLas empresas elaboradoras deberán asegurar el control analítico de las materias\nprimas, productos en elaboración y productos terminados.\nLas obligaciones del Director Técnico a que se refiere este artículo serán las\nconsignadas en el artículo 17 del presente Código, debiendo además, proveer\nasistencia técnica sobre el uso de aditivos al consumidor/usuario"".\nArtículo 1396 - (Res 1320, 20.07.88)\nEn la rotulación de todo producto alimenticio adicionado de aditivos de uso permitido\ndeberá hacerse constar su presencia, salvo excepción expresa, mediante expresiones\nque identifiquen la clase o tipo de aditivos agregados, por ejemplo: Antioxidante\npermitido, Emulsionante permitido, Conservador permitido, Colorante permitido, etc,\nsin que ello impida, si así se lo desea, la mención de cada aditivo en particular.\nLas expresiones citadas referentes a la clase o tipo de aditivos agregados implica la\nresponsabilidad de haber utilizado únicamente los permitidos por el presente Código,\nen los casos autorizados y dentro de los límites y grados de pureza establecidos.\nLos alimentos que contengan los aditivos tartrazina, ácido benzoico (ó sus sales de\ncalcio, potasio o sodio) y dioico de azufre (ó sus derivados) deberán declarar su\npresencia en el rotulado por sus nombres específicos (tartrazina, ácido benzoico,\ndióxido de azufre), con caracteres de buen tamaño, realce y visibilidad.\nRESOLUCIÓN GMC Nº 105/94\nIncorporada por Resolución MSyAS N° 184 del 30.05.95\nSe deroga toda legislación del Código Alimentario Argentino que se oponga al dictado\nde la presente Resolución\nPRINCIPIO DE TRANSFERENCIA DE ADITIVOS ALIMENTARIOS\nArt 1° - Todo aditivo alimentario que por haber sido empleado en las materias primas\nu otros ingredientes (incluyendo los aditivos alimentarios) sea transferido a un\nalimento, estará exento de la declaración en la lista de ingredientes cuando se cumplan\nlas siguientes condiciones:\na) El aditivo esté permitido en las materias primas u otros ingredientes de acuerdo\na los Reglamentos Técnicos MERCOSUR establecidos.\nb) La cantidad del aditivo en las materias primas u otros ingredientes no exceda a la\ncantidad máxima permitida en el alimento.\nc) El alimento al cual el aditivo es transferido, no contenga dicho aditivo en cantidad\nmayor que la que podría ser introducida por el uso de los ingredientes bajo\nadecuadas condiciones tecnológicas o buenas prácticas de manufactura.\nd) El aditivo transferido se encuentre presente en un nivel no funcional o sea a un\nnivel significativamente menor que el normalmente requerido para lograr una\nfunción tecnológica eficiente en el alimento.\nArt 2° - Un aditivo transferido a un alimento en una concentración significativa o\nsuficiente para ejercer una función tecnológica en ese alimento y que resulte del uso\nde materias primas u otros ingredientes en los cuales el aditivo ha sido utilizado,\ndeberá ser declarado en la lista de ingredientes.', 'Se admiten las mismas funciones que para los productos terminados que se elaboren con cada\npre-mezcla, y los aditivos para cada función en cantidades tales que el producto listo para el\nconsumo preparados segun las indicaciones del fabricante contenga como máximo las\nconcentraciones establecidas para el producto terminado. Se admite también el uso de\nantiaglutinantes/antihumectantes y conservadores (solo para premezclas de uso industrial) en\ncantidades tales que el producto listo para el consumo contenga como máximo las\nconcentraciones que se indican a continuación:\tNone\tNone\tNone\nAdmitem-se as mesmas funções para os produtos acabados que se elaborem com cada pré-\nmistura, e os aditivos para cada função em quantidades tais que o produto pronto para\nconsumo preparado segundo as indicações do fabricante contenha no máximo as\nconcentrações estabelecidas para o produto acabado. Admite-se também o uso de\nantiaglutinantes/antiumectantes e conservadores (somente para pré-misturas de uso\nindustrial) em quantidades tais que o produto pronto para consumo contenha no máximo as\nconcentrações que indicadas a seguir:\tNone\tNone\tNone\n\t\t\t\n\tANTIAGLUTINANTE/\nANTIHUMECTANTE\tANTIAGLUTINANTE/\nANTIUMECTANTE\t\nTodos los autorizados como BPF en\nMERCOSUR\tNone\tTodos os autorizados como BPF no\nMERCOSUL\tquantum satis\n341\niii\tFosfato tricálcico, calcio\nfosfato monobásico, calcio\n(mono) ortofosfato, calcio\nfosfato monobásico, calcio\nbifosfato, calcio fosfato ácido,\ncalcio dihidrógeno fosfato\tFostato tricálcico, fosfato tribásico\nde cálcio, Fosfato de Cálcio\nTribásico, Fosfato de Cálcio\nPrecipitado, Fosfato de Cálcio\t0,25 (como P O )\n2 5\n\t\t\t\n\tCONSERVADOR\tCONSERVADOR\t\nSe autorizan los siguientes conservadores solo para premezclas de uso industrial:\nAutorizam-se os seguintes conservadores somente para pré-misturas de uso industrial:\tNone\tNone\tNone\nTodos los autorizados como BPF en\nMERCOSUR\tNone\tTodos os autorizados como BPF no\nMERCOSUL\tquantum satis\n200\tÁcido sórbico\tÁcido sórbico\t0,1\n201\tSodio Sorbato\tSorbato de sódio\t0,1 como ácido\nsórbico\n202\tPotasio Sorbato\tSorbato de potássio\t0,1 como ácido\nsórbico\n203\tCalcio Sorbato\tSorbato de cálcio\t0,1 como ácido\nsórbico\n\tNone\tNone\tNone\n6.3.4. Otras harinas de cereales\n(centeno, arroz, avena, maíz, sorgo, mijo, etc)\tNone\tNone\tNone\n6.3.4. Outras farinhas de cereais\n(centeio, arroz, aveia, milho, sorgo, etc)\tNone\tNone\tNone\n\tNone\tNone\tNone\n\tANTIAGLUTINANTE/\nANTIHUMECTANTE\tANTIAGLUTINANTE/\nANTIUMECTANTE\t\n341i\tCalcio (mono) fosfato, calcio\nfosfato monobásico, calcio\n(mono) ortofosfato, calcio\nfosfato monobásico, calcio\nbifosfato, calcio fosfato ácido,\ncalcio dihidrógeno fosfato\tFosfato monocálcico, fosfato\nmonobásico de cálcio, ortofosfato\nmonocálcico, Fosfato de Cálcio\nMonobásico, Bifosfato de Cálcio,\nFosfato Ácido de Cálcio,\nDihidrogênio Fosfato de Cálcio\t0,25 (como P O )\n2 5', 'Fase: Cualquier punto, procedimiento, operación, paso o etapa del proceso de elaboración de\nun producto alimenticio definido en el alcance del plan.\nHACCP: (Hazard Analysis and Critical Control Points): Sigla en inglés reconocida\ninternacionalmente para el sistema y que en español se traduce como análisis de peligros y\npuntos críticos de control.\nInocuidad: Garantía que los alimentos no causarán daño al consumidor cuando se elaboren y/o\nconsuman de acuerdo con el uso al que se destinan.\nLímite crítico: Criterio que diferencia la aceptabilidad o inaceptabilidad del proceso en una\ndeterminada fase.\nLímites operacionales: Criterios más rigurosos que los límites críticos, empleados por el\nelaborador para reducir el riesgo de una desviación y poder realizar las correcciones al proceso\nantes que se alcance el límite crítico.\nMedida de control: Cualquier medida y actividad que puede realizarse para prevenir, eliminar o\nreducir a un nivel aceptable, un peligro para la inocuidad de los alimentos.\nMonitorear: Llevar a cabo una secuencia planificada de observaciones o mediciones de los\nparámetros de control para evaluar si un PCC está bajo control.\nPeligro: Agente biológico, químico o físico presente en el alimento, o bien la condición en que\néste se halla, que puede causar un efecto adverso para la salud.\nPeligro significativo: Aquel cuyo riesgo y gravedad, determinen que sea necesario controlar el\nproceso para asegurar su prevención, eliminación, o reducción a niveles aceptables para\nobtener un alimento inocuo.\nPlan HACCP: Documento preparado de conformidad con los principios del Sistema de HACCP,\nde tal forma que su cumplimiento asegura el control de los peligros que resultan significativos\npara la inocuidad de los alimentos.\nPlano esquemático del establecimiento: Representación gráfica del establecimiento que refleja\nla distribución de los distintos ambientes, el flujo del producto, del proceso y del personal.\nPunto crítico de control (PCC): Fase en la que debe aplicarse un control y que es esencial para\nprevenir, eliminar o reducir un peligro significativo a un nivel aceptable. Los puntos críticos de\ncontrol pueden identificarse utilizando el árbol de decisiones.\nPunto de control (PC): Cualquier punto en un proceso donde pueden ser controlados factores\nbiológicos, químicos o físicos.\nRegistro: Documento que provee evidencia objetiva de acciones realizadas o de resultados\nlogrados.\nRetiro de alimentos del mercado: Medida para gestionar un riesgo detectado por el elaborador,\ndenuncias provenientes de distintos sectores de la comunidad, actuaciones iniciadas por las\nautoridades sanitarias o un resultado adverso de una muestra oficial recolectada en inspección\nde rutina, con el objetivo de inmovilizar los alimentos implicados para impedir que lleguen al\nconsumidor y recuperar efectiva y eficientemente la cantidad total del producto de riesgo del\nmercado, incluso aquellos que se encuentren en poder de los consumidores, si se considera\nnecesario.']","Un aditivo alimentario se define como cualquier sustancia o mezcla de sustancias que directa o indirectamente modifiquen las características físicas, químicas o biológicas de un alimento, con el fin de mejorar, preservar o estabilizar el alimento. Para que un aditivo alimentario sea considerado como tal, debe cumplir con ciertas condiciones, como ser inocuo por sí mismo o a través de su acción como aditivo en las condiciones de uso, justificar su empleo por razones tecnológicas, sanitarias, nutricionales o psicosensoriales necesarias, y cumplir con las exigencias de designación y pureza establecidas en el código alimentario correspondiente.","Aditivo alime ntario: es cualquier ingrediente agregado a los alimentos intencionalmente, sin
el propósito de nutrir, con el objeto de modificar las características físicas, químicas, biológicas
o sensoriales, durante la manufactura, procesado, preparación, tratamiento, envasado,
acondicionado, almacenado, transporte o manipulación de un alimento; podrá resultar que el
propio aditivo o sus derivados se conviertan en un componente de dicho alimento. Esta
definición no incluye a los contaminantes o a las sustancias nutritivas que se incorporan a un
alimento para mantener o mejorar sus propiedades nutricionales.",0.5128477909814978,1.0,0.9389622842318991,1.0,Basic
¿Qué se define como aditivo alimentario?,"['Un aditivo alimentario se define como una sustancia que se añade a los alimentos con el fin de modificar sus características organolépticas o facilitar su elaboración, conservación, etc. Los aditivos alimentarios están regulados por normativas específicas que establecen su uso permitido, concentraciones máximas, funciones, entre otros aspectos.', 'Aditivo alimentario se define como cualquier substancia o mezcla de substancias que modifiquen las características físicas, químicas o biológicas de un alimento para su mejoramiento, preservación o estabilización, siempre y cuando sean inocuos, su uso esté justificado por razones tecnológicas, sanitarias, nutricionales o psicosensoriales, y cumplan con las exigencias de designación y pureza establecidas en el Código mencionado.', 'Los aditivos alimentarios se definen como sustancias que se pueden añadir a los alimentos con el fin de conservarlos, mejorar su aspecto, sabor, textura o facilitar su elaboración. En el caso específico de los Quesos Rallados, se permite la presencia de aditivos autorizados en el Reglamento Técnico General Mercosur de Identidad y Calidad de Quesos, así como el uso de ciertos aditivos adicionales con concentraciones máximas establecidas en el producto final. Algunos de los aditivos permitidos son el ácido sórbico o sus sales como conservador, la natamicina como conservador, la celulosa microcristalina como antiaglutinante y el dióxido de silicio como antiaglutinante, cada uno con su respectiva concentración máxima permitida en el producto final.', 'Aditivo alimentario se define como cualquier ingrediente agregado a los alimentos intencionalmente, sin el propósito de nutrir, con el objetivo de modificar características físicas, químicas, biológicas o sensoriales durante diferentes etapas de la producción y manipulación de un alimento. Esta definición excluye a los contaminantes y a las sustancias nutritivas que se incorporan a un alimento para mantener o mejorar sus propiedades nutricionales.', 'Un aditivo alimentario se define como cualquier sustancia que se añade a los alimentos con el propósito de modificar sus características organolépticas o facilitar su procesamiento o conservación. En el fragmento proporcionado, se mencionan diferentes tipos de aditivos alimentarios autorizados, como antihumectantes/antiaglutinantes, aromatizantes/saborizantes y emulsionantes, cada uno con sus respectivas concentraciones máximas permitidas. Por ejemplo, se menciona el aditivo 442, que son las Sales de Amonio de Ácidos Fosfatídicos, con una concentración máxima de 1,0 g/100g.', 'Un aditivo alimentario se define como cualquier sustancia que se añade a los alimentos con el propósito de modificar sus características organolépticas o facilitar su elaboración, conservación, envasado, transporte o manipulación. En el fragmento proporcionado no se encuentra una definición explícita de aditivo alimentario, por lo tanto, la información relevante no está presente. <irrelevant>', 'Un aditivo alimentario se define como sustancias que se añaden a los alimentos con el propósito de modificar sus características físicas, químicas, biológicas o sensoriales. Estos aditivos pueden incluir acidulantes como el ácido cítrico y el ácido tartárico, estabilizantes como la carragenina, y emulsionantes, entre otros. La concentración máxima de cada aditivo por cada 100 gramos de alimento está regulada.', 'Un aditivo alimentario se define como un regulador de acidez autorizado como BPF por el código mencionado, con una concentración máxima de 0,5 g/100g.', 'Los aditivos alimentarios se definen en el Artículo 1391 como sustancias que deben ser inocuas por sí mismas o a través de su acción como aditivos en las condiciones de uso, formar parte de la lista positiva de aditivos alimentarios del código, ser empleados exclusivamente en los alimentos mencionados en el código y cumplir con las exigencias de designación, composición, identificación y pureza establecidas en el código. Además, en el Artículo 1392 se menciona que los aditivos alimentarios pueden agregarse a los alimentos para mantener o mejorar el valor nutritivo, aumentar la estabilidad o capacidad de conservación, incrementar la aceptabilidad de alimentos sanos y genuinos, y permitir la elaboración económica y en gran escala de alimentos de composición y calidad constante en función del tiempo.', 'El texto menciona que en la rotulación de todo producto alimenticio adicionado de aditivos de uso permitido, se debe hacer constar la presencia de los aditivos mediante expresiones que identifiquen la clase o tipo de aditivos agregados, como por ejemplo: Antioxidante permitido, Emulsionante permitido, Conservador permitido, Colorante permitido, entre otros. Además, se establece que los alimentos que contengan ciertos aditivos específicos como tartrazina, ácido benzoico o dióxido de azufre, deben declarar su presencia en el rotulado por sus nombres específicos con caracteres de buen tamaño, realce y visibilidad. En resumen, un aditivo alimentario se define como una sustancia añadida a un alimento para cumplir una función tecnológica y debe ser declarado en la lista de ingredientes si está presente en una concentración significativa para ejercer una función tecnológica en el alimento.', 'Se define como aditivo alimentario a aquellas sustancias que se añaden a los alimentos con el propósito de modificar sus características organolépticas o facilitar su procesamiento. En el fragmento proporcionado no se encuentra una definición explícita de aditivo alimentario, por lo tanto, la información es <irrelevant>.', '**Relevant information:**\n- Un aditivo alimentario se define como cualquier ingrediente agregado a los alimentos intencionalmente, sin el propósito de nutrir, con el objetivo de modificar características físicas, químicas, biológicas o sensoriales durante diferentes etapas de procesamiento de alimentos. Esto puede resultar en que el aditivo o sus productos se conviertan en un componente del alimento.\n- Los aditivos alimentarios no incluyen contaminantes ni sustancias nutritivas que se agregan a un alimento para mantener o mejorar sus propiedades nutricionales.', 'Se define como aditivo alimentario a aquellas sustancias que se añaden a los alimentos con el propósito de modificar sus características organolépticas o facilitar su procesamiento, conservación y almacenamiento.', 'Se define como aditivo alimentario a aquellas sustancias que se añaden a los alimentos con el propósito de modificar sus características organolépticas o facilitar su procesamiento, conservación y almacenamiento.', 'Se define como aditivo alimentario a aquellas sustancias que se añaden a los alimentos con el fin de modificar sus características organolépticas o facilitar su conservación.', 'El texto proporciona información sobre los aditivos alimentarios permitidos en la elaboración de Queso en Polvo. Se mencionan diferentes tipos de aditivos, como reguladores de acidez, aromatizantes/saborizantes, colorantes, conservadores y emulsionantes, junto con sus concentraciones máximas permitidas en el producto final. Por ejemplo, se mencionan aditivos como ácido cítrico, ácido láctico, bicarbonato de sodio, cúrcuma, riboflavina, entre otros.', 'Se define como aditivo alimentario a aquellas sustancias que se añaden a los alimentos con el fin de modificar sus características organolépticas o facilitar su elaboración, conservación y almacenamiento.', 'Se define como aditivo alimentario a aquellos autorizados como BPF en el presente Código.', '**Relevant information:**\n\n- Se define como aditivo alimentario aquellos que pueden ser utilizados en la elaboración de quesos, y se encuentran indicados en una lista específica que también menciona la clase de queso para la cual están autorizados.\n- La utilización de otros aditivos puede estar autorizada en los artículos que describen variedades individuales o grupos de variedades individuales de quesos.', 'Un aditivo alimentario se define como cualquier sustancia que se añade a los alimentos con el propósito de modificar sus características organolépticas o facilitar su elaboración, conservación, envasado, transporte o manipulación. En el texto proporcionado se detallan diferentes tipos de aditivos alimentarios autorizados, como acidulantes, reguladores de acidez, antioxidantes, aromatizantes, colorantes y emulsificantes, junto con sus respectivas concentraciones máximas permitidas.', 'Se define como aditivo alimentario a aquellos ingredientes autorizados como Buenas Prácticas de Fabricación en MERCOSUR, que cumplen funciones como acidulantes, agentes de firmeza, antiespumantes, entre otros.']","Un aditivo alimentario se define como cualquier sustancia o mezcla de sustancias que se añade a los alimentos con el fin de modificar sus características físicas, químicas o biológicas para su mejoramiento, preservación o estabilización, siempre y cuando sean inocuos, su uso esté justificado por razones tecnológicas, sanitarias, nutricionales o psicosensoriales, y cumplan con las exigencias de designación y pureza establecidas en las normativas correspondientes.","Aditivo alime ntario: es cualquier ingrediente agregado a los alimentos intencionalmente, sin
el propósito de nutrir, con el objeto de modificar las características físicas, químicas, biológicas
o sensoriales, durante la manufactura, procesado, preparación, tratamiento, envasado,
acondicionado, almacenado, transporte o manipulación de un alimento; podrá resultar que el
propio aditivo o sus derivados se conviertan en un componente de dicho alimento. Esta
definición no incluye a los contaminantes o a las sustancias nutritivas que se incorporan a un
alimento para mantener o mejorar sus propiedades nutricionales.",0.9462001772099439,1.0,0.9733795770509462,1.0,Advanced
¿Cuáles son los límites de metales aceptados en los alimentos?,"['preparadas por la polimerización catalítica de etileno o copolimerización de éste con a-olefinas\nlineales (C3-C12).\n3.2. Las parafinas mencionadas en 3.1. deben cumplir los siguientes requisitos de pureza\ngenerales:\na) Metales pesados Las concentraciones de los metales pesados deben cumplir con los límites\ncorrespondientes a “Contaminantes en Alimentos”.\nb) Sustancias fácilmente carbonizables: deben cumplir el ensayo, conforme lo descripto en la\nFarmacopea Americana, XXIIIª edición, correspondiente a parafina.\n3.3. Las parafinas mencionadas en 3.1. deben cumplir los siguientes requisitos específicos:\n3.3.1. Parafina sintética: deberá cumplir los siguientes requisitos:\na) Contenido de aceite de acuerdo al Método ASTM D721: máximo 2,5% m/m. Para recubrimiento\nde quesos el contenido de aceite máximo es 0,5% m/m.\nb) Absortividad: De acuerdo al Método ASTM D2008 la sustancia debe presentar una absortividad a\n290 nm en decahidronaftaleno a 88° C no mayor que 0,01.\nc) Punto de congelamiento de acuerdo con Método ASTM D938: las parafinas sintéticas con punto\nde congelamiento menor que 50ºC cuando se usan en contacto con alimentos grasos (Tipo IV) o\nacuosos ácidos o no ácidos que contienen grasas o aceites (Tipo III), a temperatura ambiente o\nmenor, no deben exceder de un 15% m/m del recubrimiento. Para recubrimiento de quesos el\npunto de congelamiento debe tener un valor entre 93 y 99° C.\n3.3.2. Ceras de petróleo: la absortividad a 290 nm, medida con Método ASTM D 2008, no deberá\nsuperar 0,12.\n3.4. Las parafinas mencionadas en 3.1. pueden contener cualquier antioxidante permitido para\nalimentos, en las concentraciones mínimas requeridas para la obtención del efecto deseado o\ntetrakis(metilen(3,5-di-ter-butil-4-hidroxihidrocinamato))- metano, como máximo 0,1% m/m.\n3.5. Para la elaboración de los recubrimientos a que se refiere el presente reglamento, se podrá\nagregar a las ceras mencionadas en 3.1., y siempre que la cantidad utilizada sea la mínima\nnecesaria para obtener las características técnicas deseadas, las siguientes sustancias:\n3.5.1. A todos los productos contemplados en este reglamento:\na) Aditivos alimentarios permitidos en el alimento destinado a recubrir o con el que van a entrar en\ncontacto directo, siempre que la cantidad presente en el alimento sumada a la que eventualmente\npudiera migrar desde el recubrimiento, no supere los límites establecidos para cada alimento\nb) Cualquier otra sustancia permitida en la formulación de alimentos siempre que su migración a\nlos mismos no sea detectable.\n3.5.2. Para el recubrimiento de envases y equipamientos celulósicos se permitirá además el\nagregado de:\na) Politerpenos: Son mezclas de hidrocarburos alifáticos y cicloalifáticos, que se preparan por\npolimerización de hidrocarburos terpénicos y deben cumplir las siguientes especificaciones: § El\npunto de ablandamiento de acuerdo al Método anillo – bola (ring/ball), DIN 1995 U 4, debe estar\nubicado entre 50° C y 130° C. § La viscosidad cinemática, de acuerdo a Norma DIN 51562, en una', '2.7. Queda permitido reciclar los materiales metálicos, siempre que los mismos sean sometidos a\nun proceso que permita cumplir las especificaciones del presente Reglamento.\n2.8. Los materiales metálicos no deben contener más de 1% (m/m) de impurezas constituidas por\nplomo, arsénico, cadmio, mercurio, antimonio y cobre considerados en conjunto. El límite\nindividual de arsénico, mercurio y plomo no debe ser mayor de 0,01% (m/m).\n2.9. Los metales contaminantes no deberán migrar en cantidades superiores a los límites\nestablecidos en el Reglamento Técnico MERCOSUR sobre contaminantes inorgánicos en alimentos o\nen los reglamentos técnicos específicos.\n3. LISTAS POSITIVAS DE MATERIAS PRIMAS PARA ENVASES Y EQUIPAMIENTOS\nMETÁLICOS\nEn la elaboración de envases y equipamientos metálicos, podrán ser empleados los siguientes\nmateriales:\n3.1. Materias primas metálicas:\n3.1.1. Acero y sus aleaciones inoxidables listadas a continuación:\nAISI (American Iron and Steel\nUNS Normas EN (Euro Norm)\nInstitute)\n202 S 20200\n301 S 30100 1.4310\n302 S 30200\n303 S 30300 1.4305\n303 Se S 30323\n304 S 30400 1.4301\n304 L S 30403 1.4307\n305 S 30500 1.4303\n308\n316 S 31600 1.4401\n316 L S 31603 1.4404\n321 S 32100 1.4541\n347 S 34700 1.4550\n410 S 41000 1.4006\n416 S 41600 1.4005\n420 S 42000 1.4028\n430 S 43000 1.4016\n430 F S 43000 1.4016\n431 S 43100 1.4057\n1.4110\n1.4116\n444 S 44400 1.4521\n439 S 43035 1.4510\nS 41050 1.4003\nS 32304 1.4362\nS 31803 1.4462\nS 32760 1.4501\n3.1.2. Hierro fundido o batido.\n3.1.3. Aluminio técnicamente puro y sus aleaciones.\n3.1.4. Acero revestido con cromo (chapa cromada) con la superficie totalmente enlozada,\nvitrificada, esmaltada o protegida con revestimientos poliméricos.\n3.1.5. Acero no revestido (chapa negra) protegida su superficie totalmente con revestimientos\npoliméricos, enlozados, vitrificados o esmaltados.\n3.1.6. Cobre, latón o bronce revestidos íntegramente por una capa de oro, plata, níquel o estaño\ntécnicamente puros. Se permite el uso de equipamientos de cobre sin revestimiento para\nelaboración de alimentos particulares a nivel industrial y/o artesanal a criterio de la Autoridad\nSanitaria Competente siempre que se demuestre su función tecnológica de uso.\n3.1.7. Estaño, níquel y plata.\n3.1.8. Hierro enlozado o esmaltado que cumpla con las exigencias establecidas en el Reglamento\nTécnico MERCOSUR “Envases y equipamientos de vidrio y cerámica destinados a entrar en\ncontacto con alimentos”.\n3.1.9. Hojalata:\n3.1.9.1. Hojalata sin recubrimiento polimérico.\n3.1.9.2. Hojalata con recubrimiento polimérico interno, total o parcial.\nEn ambos casos la cantidad de estaño de la hojalata será la necesaria para cumplir la función\ntecnológica.\n3.2. Revestimientos poliméricos:\nSolamente podrán ser elaborados con las sustancias incluidas en las listas positivas de\nmonómeros, otras sustancias de partida y polímeros, y de aditivos destinados a la elaboración de\nmateriales plásticos y revestimientos poliméricos en contacto con alimentos con sus restricciones', 'Contenido libre de ácidos grasos\tMáx. 0,5 %,\nResiduo de ignición\tMáx. 0,5 %\nTotal de metales pesados\tMáx. 10 ppm\nPlomo\tMáx. 0,1 ppm\nTotal de metanol disponible\tMáx. 300 ppm\nAgua\tMáx. 0,1 %\nIndice de peróxidos\tMáx. 10 meq de oxígeno/kg', 'Queda prohibido el uso de:\n1. Hierro galvanizado o cincado.\n2. El revestimiento interno de envases, tubos, utensilios u otros elementos con cadmio.\n3. Los materiales (metales, materiales plásticos, etc.), que pueden ceder a los alimentos, metales\no metaloides en proporción superior a las establecidas en el Artículo 156"".\nPAPELES y CARTONES\nArtículo 186bis - (Resolución Conjunta RESFC-2019-1-APN-SRYGS#MSYDS Nº1/2019)\n[Otórgase a las empresas un plazo de CIENTO OCHENTA (180) días para su adecuación,\nexcepto en lo referido al plazo de adecuación del límite de migración específica (LME)\nestablecido para la antraquinona en el punto 2.1.1 de la Parte II, el cual se aplicará a\npartir del último día hábil de diciembre del año 2020. Hasta tanto sea alcanzado el plazo\nmencionado, la restricción para el uso de antraquinona en los materiales, envases y\nequipamientos celulósicos destinados a entrar en contacto con alimentos será sustituida\npor el límite de migración específica (LME) de 0,1 mg de antraquinona/kg de alimento\nhasta el penúltimo día hábil de diciembre de 2020.]\nRESOLUCIÓN GRUPO MERCADO COMÚN N° 40/15 “REGLAMENTO TÉCNICO MERCOSUR\nSOBRE MATERIALES, ENVASES Y EQUIPAMIENTOS CELULÓSICOS DESTINADOS A ESTAR\nEN CONTACTO CON ALIMENTOS (DEROGACIÓN DE LAS RESOLUCIONES GMC N° 19/94,\n12/95, 35/97, 56/97, 52/99 Y 20/00)”.\nPARTE I\n1. ALCANCE\n1.1. El presente Reglamento Técnico se aplica a los materiales, envases y equipamientos cuya cara\ndestinada a estar en contacto con el alimento o con materias primas para alimentos (de aquí en\nadelante denominados “alimentos”) sea celulósica o celulósica revestida o tratada con ceras,\nparafinas, aceites minerales y pigmentos minerales (coating) previstos en la PARTE II del presente\nReglamento. En adelante se denominarán como envases y equipamientos celulósicos.\n1.2. Se aplica también a los envases y equipamientos compuestos por capas de un mismo material\no de diferentes materiales (multicapas), siempre que aquellos cumplan con lo previsto en el ítem\n1.1.\n1.3. Se aplica también a los envases y equipamientos que contengan fibras celulósicas\nprovenientes de material reciclado mencionadas en el ítem 1.2 de la PARTE II del presente\nReglamento - “Lista Positiva de Componentes para Materiales, Envases y Equipamientos\nCelulósicos en Contacto con Alimentos”.\n1.4. El presente Reglamento Técnico no se aplica a los envases secundarios fabricados con papel,\ncartulina o cartón, siempre que se asegure que aquellos no entren en contacto con alimentos, no\ninterfieran en la integridad de los alimentos y no trasfieran a ellos sustancias perjudiciales a la\nsalud.\n1.5. El presente Reglamento no se aplica a los materiales, envases y equipamientos celulósicos\ndestinados a estar en contacto con alimentos que siempre deben ser pelados para su consumo,\nsiempre y cuando se asegure que no modifiquen las características organolépticas del alimento y\nno transfieran sustancias perjudiciales para la salud.', 'CAPITULO VII\nALIMENTOS GRASOS ACEITES ALIMENTICIOS\nArtículo 520\nSe consideran Aceites alimenticios o Aceites comestibles, los admitidos como aptos para la\nalimentación por el presente y los que en el futuro sean aceptados como tales por la autoridad\nsanitaria nacional.\nLos aceites alimenticios se obtendrán a partir de semillas o frutos oleaginosos mediante\nprocesos de elaboración que se ajusten a las condiciones de higiene establecidas por el\npresente.\nPresentarán aspecto límpido a 25°C, sabor y olor agradables y contendrán solamente los\ncomponentes propios del aceite que integra la composición de las semillas o frutos de que\nprovienen y los aditivos que para el caso autoriza el presente.\nArtículo 521 - (Res 626, 13.8.86)\n""Los aceites alimenticios se clasificarán de la siguiente manera:\n1. Aceite de: corresponde al aceite alimenticio proveniente de una sola especie vegetal.\nA los efectos de su obtención industrial, se admitirá la presencia de otro aceite en carácter de\ncontaminante en una proporción máxima del 5,0% en peso. Quedan exceptuados los aceites de\noliva, los que deberán responder y ajustarse exactamente a su denominación y, por\nconsiguiente, no se admitirá la presencia de ningún otro aceite.\nEstos productos se rotularán: Aceite de... (llenando el espacio en blanco con el nombre del\nvegetal del cual procede).""\n2. (Res 413, 1.3.83)\n""Aceite comestible mezcla: Es el aceite alimenticio constituido por la mezcla de 2 o más\naceites alimenticios obtenidos de diferentes especies vegetales.\nSólo se considerará como tal aquel cuyos aceites componentes estén presentes en una\nproporción superior al 5%.\nEste producto se rotulará: Aceite comestible mezcla pudiendo indicarse el nombre de los\naceites componentes y sus respectivos porcentajes, en orden decreciente de sus proporciones,\ncon caracteres uniformes, del mismo tamaño y relevancia"".\nArtículo 522 - (Res 953, 11.6.85)\n""La representación gráfica del olivo o de sus frutos, o de cualquier otra especie vegetal, las\ndesignaciones de fantasía que contengan las palabras olivo y oliva o las correspondientes a\ncualquier otra especie vegetal, sólo podrán usarse en los rótulos, publicidad y proyectos que se\nrefieran al aceite proveniente de una sola especie vegetal"".\nArtículo 523 - (Res 2012, 19.10.84)\n""Queda prohibido adicionar a los aceites alimenticios substancias extrañas destinadas a dar\nsabor, aroma, color o a modificar sus caracteres fisicoquímicos"".\nArtículo 523bis - (Res 2012, 19.10.84)\n""Los aceites y grasas vegetales comestibles podrán ser adicionados, con la exclusión de los\naceites de oliva de presión no refinados, de los siguientes antioxidantes y sinergistas:\n1. Galato de propilo, galato de octilo y galato de dodecilo (o sus mezclas), Máx: 100 mg/kg\n(100 ppm), aislados o mezclados.\n2. Hidroxianisol butilado (BHA), Máx: 200 mg/kg (200 ppm).\n3. Hidroxitolueno butilado (BHT), Máx: 200 mg/kg (200 ppm)\n4. Terbutilhidroquinona (TBHQ), Máx: 200 mg/kg (200 ppm).', 'a) Se cumplan las restricciones establecidas para su uso en los alimentos; y\nb) La cantidad de aditivo presente en el alimento sumado al que eventualmente pueda\nmigrar del envase no excedan los límites establecidos para cada alimento.\n4.3. Las sustancias indicadas también están autorizadas para su uso como aditivos en la\nelaboración de materiales plásticos y revestimientos poliméricos destinados al contacto con\nalimentos, según lo establecido en el ítem 5 de este Reglamento, las disposiciones generales\npara materiales plásticos definidos en el Reglamento Técnico MERCOSUR y las restricciones y las\nespecificaciones definidas en el Cuadro1:\na) Sales (incluyendo las sales dobles y las sales ácidas) de amonio, calcio, magnesio,\npotasio y sodio de ácidos, fenoles o alcoholes autorizados;\nb) Sales (incluyendo las sales dobles y las sales ácidas) de aluminio, bario, cobalto, cobre,\nhierro, litio, manganeso y zinc de ácidos, fenoles o alcoholes autorizados. Para estas sales\nse aplican los siguientes Límites de Migración Específica grupal - LME (T):\nAluminio = 1 mg/kg de alimento o simulante alimentario.\nBario = 1 mg/kg de alimento o simulante alimentario.\nCobalto = 0,05 mg/kg de alimento o simulante alimentario.\nCobre = 5 mg/kg de alimento o simulante alimentario.\nHierro = 48 mg/kg de alimento o simulante alimentario.\nLitio = 0,6 mg/kg alimento o simulante alimentario.\nManganeso = 0,6 mg/kg de alimento o simulante alimentario.\nNíquel = 0,02 mg/kg de alimento o simulante alimentario.\nZinc= 5 mg/kg de alimento o simulante alimentario.\nPara los revestimientos poliméricos la evaluación del LME (T) de aluminio, bario, cobalto,\ncobre, hierro, litio, manganeso, níquel y zinc podrá ser realizada sobre el sustrato inerte;\nc) Cuando se listen ácidos, fenoles o alcoholes, seguidos de la palabra “sales” significa que\nestán autorizadas solo las sales de los cationes mencionados en los puntos (a) y (b), y no\nestán autorizados los ácidos, fenoles o alcoholes libres correspondientes;\nd) Mezclas de sustancias autorizadas en que los componentes no tengan reacción química\nentre sí; y\ne) Sustancias poliméricas naturales o sintéticas de masa molecular igual o superior a\n1.000 Da que cumplan los requisitos del Reglamento Técnico MERCOSUR referente a la lista\npositiva de monómeros, otras sustancias iniciadoras y polímeros, si pueden proporcionar el\nprincipal componente estructural de los materiales y objetos finales excepto macromoléculas\nobtenidas por fermentación microbiana.\n4.4. La lista positiva no incluye las siguientes sustancias que se pueden encontrar en el producto\nterminado:\na) Sustancias residuales, también conocidos como sustancias no intencionalmente añadidas\nque incluyen:\n- impurezas de las sustancias utilizadas;\n- productos intermedios de reacción formados durante el proceso de producción; y\n- productos de descomposición reacción.\nb) Los siguientes auxiliares de polimerización: sistemas catalíticos iniciadores, aceleradores,', 'Los hornos de cocción deben estar a 50 cm, como mínimo, de las paredes linderas.\nTanto el personal como los locales donde funcionan estos establecimientos y el instrumental\n(sartenes, cubiertos, cortadoras de fiambres, etc), deben cumplir las disposiciones del\npresente.\nLos productos elaborados se pondrán en bandejas o fuentes de cerámica o de metal inoxidable\nque permita el escurrimiento de la materia grasa y se colocarán cestos, con su correspondiente\ncartel, para que el público arroje en ellos las servilletas usadas.\nArtículo 137\nEn los locales (confiterías, cafés, bares, lecherías, pizzerías, etc) donde se consuman\nempanadas, sandwiches, productos de pizzería y menudencias, miniaturas o ingredientes de\ncopetín, sólo se admitirá sin cargo la devolución de los productos que se expendan protegidos\ncon papel y cierres de seguridad (broche metálico); en caso contrario los artículos devueltos\npor el cliente que los consumió deben inutilizarse en el acto, aun cuando no se hayan abonado,\nhaciéndose responsable el mozo, juntamente con el propietario del negocio, del incumplimiento\nde esta disposición.\nLa autoridad sanitaria establecerá el período de aptitud para cada uno de estos productos.\nCOCINAS Y COMEDORES\nArtículo 138\nCocinas: Las cocinas de los bares, casa de comidas, casas de huéspedes, clubes, etc, tendrán\nla amplitud requerida en relación directa con la importancia del establecimiento, reuniendo\nademás las siguientes condiciones:\n1. Ser bien aireadas y ventiladas; los pisos serán de material impermeable aprobado por\nla autoridad competente y las paredes deberán estar revestidas hasta una altura mínima de\n1,80 m con material similar.\n2. Las aberturas estarán provistas de cierre automático y tela metálica o de material\nplástico, para evitar la entrada de insectos.\n3. Cuando existan fogones u hornallas de material serán revestidos totalmente de\nazulejos blancos, con excepción de la parte superior (llamada plancha), que podrá ser de acero\no baldosas coloradas, de las conocidas con el nombre de Marsella o similares.\n4. Tendrán piletas en número necesario para el lavado de los útiles de trabajo con el\ncorrespondiente servicio de agua corriente, y los desagües conectados con la red cloacal o con\nel pozo sumidero y caño de ventilación reglamentarios, quedando terminantemente prohibido\nlavar ropa en dichas piletas.\nA cada lado de las piletas habrá dos escurrideros, uno para útiles sucios y el otro para el\nmaterial limpio.\n5. Las chimeneas, hornos y hogares deberán ser instalados y funcionar de acuerdo con\nlas disposiciones que rijan sobre la materia.\n6. En las cocinas no podrán guardarse ni tenerse otras cosas que los utensilios, enseres\nde trabajo y los artículos necesarios para la confección de las comidas diarias, dispuestos en\nforma que esté garantizada su higiene.\n7. Los productos destinados a la preparación de las comidas deberán depositarse en\nlocal separado y adecuado; las hortalizas deben depositarse en estantes protegidos con telas', 'límite MERCOSUR, fundamentado en el análisis de riesgos para la situación específica,\nbasado en la evaluación de datos científicos.\n1.5 - Los contenidos máximos permitidos especificados en la Parte II se aplicarán a la parte\ncomestible de los productos alimenticios en cuestión, salvo que se especifique lo contrario en\nparticular.\n1.6 - Los contenidos máximos se aplican al producto en el estado en que se ofrece al\nconsumidor.\nPara productos no contemplados en la tabla que consta en la Parte II, elaborados a partir de\ningredientes con límites establecidos en el presente Reglamento y que hayan sido\ndesecados, diluidos, transformados o compuestos por uno o más ingredientes, los\ncontenidos máximos permitidos deben deducirse de los factores específicos de concentración\ny dilución, en relación con los límites establecidos para los ingredientes, que se deberán\nproporcionar en el momento en que la Autoridad Sanitaria competente lo solicite.\nCuando se apliquen los límites máximos establecidos en la Parte II a los productos\nalimenticios que estén desecados, diluidos, transformados o compuestos por uno o más\ningredientes, deberá tenerse en cuenta lo siguiente:\na) los cambios de concentración del contaminante provocados por los procesos de secado o\ndilución;\nb) los cambios de concentración del contaminante, provocados por los procesos de\ntransformación;\nc) las proporciones relativas de los ingredientes en el producto;\nd) el límite analítico de cuantificación.\n1.7 - El elaborador del producto deberá comunicar y justificar, a solicitud y en el plazo\nrequerido por la Autoridad Sanitaria competente, la información relativa a la proporción de\nlos ingredientes en el producto (si fuese necesario), así como los factores específicos de\nconcentración o dilución para cada una de las operaciones de secado, dilución,\ntransformación y/o mezcla en cuestión, o para los productos alimenticios desecados,\ndiluidos, transformados y/o compuestos de que se trate.\nSi el elaborador del producto no comunica el factor de concentración o dilución necesario, o\nsi la Autoridad Sanitaria competente considera que este factor es inadecuado, teniendo en\ncuenta la justificación comunicada, dicha Autoridad definirá tal factor a partir de la\ninformación disponible.\n1.8 - Los criterios 1.6 y 1.7 se aplicarán siempre que no se hayan establecido contenidos\nmáximos específicos para estos productos alimenticios desecados, diluidos, transformados o\ncompuestos.\n1.9 - Los productos alimenticios que incumplan los contenidos máximos establecidos en las\ntablas anexas no se utilizarán como ingredientes alimentarios.\n2 - Criterios específicos\n2.1 - El contenido máximo se aplica después de lavar las frutas o las hortalizas y separar la\nparte comestible según corresponda. En el caso de las papas, el contenido máximo se aplica\na las papas peladas.\n2.2 - El contenido máximo hace referencia a la parte comestible de las frutas secas.\n2.3 - Para el caso de los cereales, el contenido máximo se aplica a:', 'Requisito\tValores aceptados\tMétodo de análisis\nDensidad a 15ºC\t1,027-1,039\tAOAC 18th Ed. 925.22']","Los límites de metales aceptados en los alimentos, de acuerdo con el Reglamento Técnico MERCOSUR sobre contaminantes inorgánicos en alimentos y los reglamentos técnicos específicos, establecen que los materiales metálicos no deben contener más de 1% (m/m) de impurezas constituidas por plomo, arsénico, cadmio, mercurio, antimonio y cobre considerados en conjunto. Además, el límite individual de arsénico, mercurio y plomo no debe ser mayor de 0,01% (m/m). Estos metales contaminantes no deben migrar en cantidades superiores a los límites establecidos en dichos reglamentos.","Artículo 156 - (Res. 1546, 17.9.85)
""En los alimentos en general (con las excepciones particularmente previstas en el presente
Código) se tolera la presencia de los siguientes elementos metálicos y no metálicos dentro
de los límites que se establecen a continuación:
Máximos - Miligramos por kilogramo
Antimonio 2
Arsénico:
en líquidos 0,1
en sólidos 1
Boro 80
Cobre 10
Estaño 250
Flúor 1,5
Plata 1
Plomo 2
Zinc 100",0.9317956349089874,1.0,0.8979377597523522,1.0,Basic
¿Cuáles son los límites de metales aceptados en los alimentos?,"['El Reglamento establece que los materiales metálicos no deben contener más de 1% (m/m) de impurezas constituidas por plomo, arsénico, cadmio, mercurio, antimonio y cobre considerados en conjunto. Además, el límite individual de arsénico, mercurio y plomo no debe ser mayor de 0,01% (m/m).', 'Total de metales pesados\tMáx. 10 ppm\nPlomo\tMáx. 0,1 ppm\n\nSegún el fragmento proporcionado, los límites de metales aceptados en los alimentos son un máximo de 10 partes por millón (ppm) para metales pesados en general y un máximo de 0,1 ppm para plomo específicamente.', 'Los límites de metales aceptados en los alimentos son los siguientes:\n- Aluminio: 1 mg/kg de alimento o simulante alimentario.\n- Bario: 1 mg/kg de alimento o simulante alimentario.\n- Cobalto: 0,05 mg/kg de alimento o simulante alimentario.\n- Cobre: 5 mg/kg de alimento o simulante alimentario.\n- Hierro: 48 mg/kg de alimento o simulante alimentario.\n- Litio: 0,6 mg/kg alimento o simulante alimentario.\n- Manganeso: 0,6 mg/kg de alimento o simulante alimentario.\n- Níquel: 0,02 mg/kg de alimento o simulante alimentario.\n- Zinc: 5 mg/kg de alimento o simulante alimentario.', 'Los límites de metales aceptados en los alimentos, específicamente en objetos de materias plásticas destinados a estar en contacto con alimentos, son los siguientes:\n\n- Arsénico: máximo 0,005% soluble en NaOH 1N\n- Bario: máximo 0,01% soluble en HCl N/10\n- Cadmio: máximo 0,20% soluble en HCl N/10\n- Cinc: máximo 0,20% soluble en HCl N/10\n- Mercurio: máximo 0,005% soluble en HCl N/10\n- Plomo: máximo 0,01% soluble en HNO3 1N\n- Selenio: máximo 0,01% soluble en HCl N/10\n- Contenido de aminas aromáticas no debe ser superior al 0,05% p/p\n\nAdemás, se prohíbe el empleo de materias plásticas de segundo uso en la elaboración de objetos destinados a estar en contacto con alimentos.', 'Los límites de metales aceptados en los alimentos son los siguientes:\n- Cadmio (Cd): Menor a 1000 µg por kilo de carne de moluscos.\n- Plomo (Pb): Menor a 1000 µg por kilo de carne de moluscos.\n- Mercurio (Hg): Menor a 500 µg por kilo de carne de moluscos.', '**Relevant information:**\n- Los límites de metales aceptados en los alimentos están establecidos en el Artículo 188bis del Código mencionado.\n- Los envases metálicos no deben ceder plomo, cinc, antimonio, cobre, cromo, hierro, estaño en cantidades superiores a las establecidas en el Artículo 156, ni otros contaminantes constituidos por metales o metaloides que puedan considerarse nocivos.\n- Se mencionan pruebas específicas para evaluar la cesión de metales en diferentes tipos de productos alimenticios envasados en envases metálicos.\n- En el Artículo 189 se establece que en la pintura, decorado y esmaltado de envases solo son permitidos colorantes y pigmentos inofensivos, prohibiendo aquellos que contengan metales como antimonio, arsénico, bario, cadmio, cobre, cromo, mercurio, plomo, uranio y cinc bajo formas solubles.\n- El Artículo 190 menciona que los barnices para la protección interna de depósitos de agua de bebida no deben contener antimonio, arsénico, entre otros.', 'Los límites de metales aceptados en los alimentos son los siguientes:\n- Para bebidas en envases de hojalata, incluidos los zumos de frutas y verduras, el límite máximo es de 150 mg/kg.\n- Para alimentos en envases de hojalata que no sean bebidas, el límite máximo es de 250 mg/kg.', 'Los límites de metales aceptados en los alimentos en el contexto del Reglamento Técnico MERCOSUR sobre Límites Máximos de Contaminantes Inorgánicos en Alimentos se establecen en la Parte II del reglamento. En dicha parte se indican los límites permitidos para elementos metálicos y no metálicos en los alimentos contemplados en el reglamento. Además, se enfatiza en la importancia de mantener los niveles de contaminantes inorgánicos en los alimentos lo más bajos posibles, aplicando medidas preventivas en todas las etapas de producción y comercialización para evitar la presencia de alimentos contaminados.', 'El límite máximo de metales aceptado en pescados, excepto predadores, es de 0,50 mg/kg.']","Los límites de metales aceptados en los alimentos varían dependiendo del metal en cuestión. Según el fragmento proporcionado, para metales pesados en general el límite es de un máximo de 10 partes por millón (ppm), mientras que para plomo específicamente el límite es de un máximo de 0,1 ppm. Además, se establece que el límite individual de arsénico, mercurio y plomo no debe ser mayor de 0,01% (m/m).","Artículo 156 - (Res. 1546, 17.9.85)
""En los alimentos en general (con las excepciones particularmente previstas en el presente
Código) se tolera la presencia de los siguientes elementos metálicos y no metálicos dentro
de los límites que se establecen a continuación:
Máximos - Miligramos por kilogramo
Antimonio 2
Arsénico:
en líquidos 0,1
en sólidos 1
Boro 80
Cobre 10
Estaño 250
Flúor 1,5
Plata 1
Plomo 2
Zinc 100",0.8083900226641885,0.7142857142857143,0.9035325700653516,0.0,Advanced
¿Qué antioxidantes o sinergistas pueden agregarse a los aceites y grasas vegetales comestibles?,"['Aceites y grasas comestibles de origen vegetal y/o animal\n(incluye margarina)\t0,10\nAzúcares\t0,10\nMiel\t0,30\nCaramelos duros y blandos y similares incluidos goma de mascar\t0,10\nPasta de cacao\t0,50\nChocolates y productos de cacao con menos de 40 % de cacao\t0,20\nChocolates y productos a base de cacao con más de 40 % de cacao\t0,40\nBebidas analcohólicas (excluidos los jugos)\t0,05\nZumos (Jugos) y néctares de frutas\t0,10\nBebidas alcohólicas fermentadas y fermento-destiladas, excepto vino\t0,10\nVino\t0,20 mg/L\nCereales y productos de y a base de cereales, excluidos trigo, arroz y\nsus productos derivados y aceites\t0,30\nTrigo y sus derivados excepto aceite\t0,20\nArroz y sus derivados excepto aceite\t0,30\nHortalizas del género Brassica (excluidas las de hojas sueltas)\t0,30\nHortalizas de hoja (incluidas las Brassicas de hoja suelta) y hierbas\naromáticas frescas\t0,30\nHortalizas de bulbo y hojas envainadoras\t0,10\nHortalizas de fruto de la familia Curcubitaceae\t0,10\nHortalizas de fruto, distintas de las de la familia Curcubitaceae\t0,10\nSetas (hongos) excepto las del género Agaricus, Pleurotus y Lentinula\no Lentinus\t0,10\nHortalizas leguminosa\t0,10\nLegumbres (semillas secas de las leguminosas) excepto soja\t0,10\nSetas (hongos) del género Agaricus, Pleurotus y Lentinula o Lentinus\t0,30\nRaíces y tubérculos\t0,20\nTallos jóvenes y pecíolos\t0,20\nFrutas secas\t0,80\nFrutas frescas, excluidas las bayas y frutas pequeñas\t0,30\nFrutas frescas de bayas y frutas pequeñas\t0,30\nAceitunas de mesa\t0,30\nConcentrados de tomate\t0,50', '11. Esteres de ácidos grasos y sacarosa (INS 473) y sucroglicéridos (INS 474), Máx. 1% en\npeso.\nArtículo 551 - (Resolución Conjunta SPReI N° 203/2013 y SAGyP N° 296/2013)\n“Con la denominación de Margarina, se entiende el alimento constituido por una fase acuosa\níntimamente mezclada con una fase grasa alimenticia formando una emulsión plástica. La fase\ngrasa podrá estar constituida por:\na) Grasas animales comestibles (enteras o fraccionadas)\nb) Aceites vegetales comestibles (enteros o fraccionados)\nc) Aceites y/o grasas comestibles hidrogenados, los que no podrán constituir la totalidad de la\nfase grasa, debiéndose incluir obligatoriamente en la misma aceites o grasas no hidrogenados.\nd) Aceites y grasas interesterificados y/o transesterificados.\ne) Mezcla de las substancias grasas mencionadas precedentemente.\nf) Grasa de leche, Máx.: 5,0% en peso.\nEn la elaboración de la margarina queda permitido el empleo de los siguientes ingredientes y\naditivos:\na) Leche pasteurizada, leche en polvo (entera, parcial o totalmente descremada) y/o crema de\nleche pasteurizada.\nb) Edulcorantes nutritivos, autorizados por el presente Código, Máx.: 2% en peso.\nc) Proteínas comestibles incluyendo, pero no limitadas a, suero líquido, condensado o seco,\nsuero modificado por la reducción de lactosa y/o minerales, componentes del suero libre de\nlactosa, albúmina, caseína, caseinato, en cantidades no mayores a las requeridas para lograr el\nefecto deseado.\nd) Sal (cloruro de sodio), Máx.: 3% en peso.\ne) Colorantes de origen vegetal de uso permitido consignados en el Artículo 1324 del presente\ny/o sus equivalentes sintéticos.\nf) Diacetilo, como reforzador de la aromatización biológica, Máx.: 1 mg/kg (1 ppm).\ng) Aromatizantes sintéticos cuyos componentes, purezas y dosis hubieren sido previamente\nautorizados por la autoridad sanitaria nacional.\nh) Antioxidantes y sinergistas autorizados en el Artículo 523 bis y en las concentraciones que\ncorrespondan según su contenido graso.\ni) Substancias conservadoras: ácido sórbico y/o ácido benzoico y/o sus sales autorizadas por el\npresente Código en cantidades no superiores a 1 g/kg (1000 ppm) expresados como ácidos.\nj) Agentes emulsionantes: los consignados en el Artículo 550 y en las mismas proporciones.\nk) Lecitina, Máx.: 0,2% en peso.\nl) Vitaminas: sólo se autoriza en las margarinas rotuladas para untar y en las siguientes\ncantidades:\nVitamina A: 15.000 a 30.000 UI/kg equivalente a 4500 a 15.000 microgramos/kg de retinol.\nVitamina D: 1.500 a 3.000 UI/kg equivalente a 37,5 a 75,0 microgramos/kg de colecalciferol.\nm) Reguladores de Acidez: ácido cítrico y láctico q.s.\nLa margarina deberá responder a las siguientes características y/o exigencias físicas, químicas\ny microbiológicas:\n1. El contenido de materia grasa no será menor de 80,0% en peso.\n2. La cantidad de agua no será mayor de 16% en peso.\n3. La fase grasa presentará un punto de fusión no mayor de 42°C en las margarinas para untar\ny de 48°C en las margarinas para uso culinario.', '\tA. hortalizas secas o deshidratadas\nenteras o en forma de polvo o harina\t\t\t\t\n\tB. hortalizas cortadas o en forma de\npuré\tX(a)\tX(a)\t\t\n\tC. hortalizas en conserva:\t\t\t\t\n\tI. en medio acuoso\tX(a)\tX(a)\t\t\n\tII. en medio oleoso\tX(a)\tX(a)\t\tX\n\tIII. en medio alcohólico (≥ 5%\n(v/v))\t\tX(1)\tX (2)\t\n05\tGRASAS Y ACEITES\t\t\t\t\n05.01\tGrasas y aceites animales y\nvegetales naturales o tratadas\n(incluyendo manteca de cacao,\nmanteca fundida, grasa de cerdo)\t\t\t\tX\n05.02\tMargarina, manteca y otros\nproductos constituidos por\nemulsiones de agua en aceite\t\t\t\tX/2\n06\tPRODUCTOS DE ORIGEN ANIMAL Y\nHUEVOS\t\t\t\t\n06.01\tPescado:\t\t\t\t\n\tA. fresco, refrigerado, salado,\nahumado\tX\t\t\tX/3(3)\n\tB. en pasta\tX\t\t\tX/3(3)\n06.02\tCrustáceos y moluscos (incluye\nostras, caracoles, mejillones) no\nprotegidos por sus valvas o\ncaparazones\tX\t\t\t\n06.03\tCarnes de todas las especies\nzoológicas (incluye aves y productos\nde caza):\t\t\t\t\n\tA. frescas, refrigeradas, saladas,\nahumadas\tX\t\t\tX/4\n\tB. en pasta o cremas\tX\t\t\tX/4\n06.04\tCarnes procesadas (jamón, salames,\ntocinos, embutidos, etc.)\tX\t\t\tX/4\n06.05\tConservas y semiconservas de carne\t\t\t\t']","Los antioxidantes o sinergistas que pueden agregarse a los aceites y grasas vegetales comestibles, según el contexto proporcionado, son aquellos autorizados en el Artículo 523 bis y en las concentraciones que correspondan según su contenido graso.","Artículo 523bis - (Res 2012, 19.10.84)
""Los aceites y grasas vegetales comestibles podrán ser adicionados, con la exclusión de los
aceites de oliva de presión no refinados, de los siguientes antioxidantes y sinergistas:
1. Galato de propilo, galato de octilo y galato de dodecilo (o sus mezclas), Máx: 100 mg/kg
(100 ppm), aislados o mezclados.
2. Hidroxianisol butilado (BHA), Máx: 200 mg/kg (200 ppm).
3. Hidroxitolueno butilado (BHT), Máx: 200 mg/kg (200 ppm)
4. Terbutilhidroquinona (TBHQ), Máx: 200 mg/kg (200 ppm).
5. Mezcla de los galatos citados, BHA y/o BHT, Máx: 200 mg/kg (200 ppm) siempre que no
incorporen más de 100 mg/kg (100 ppm) de galatos.
6. Mezclas de TBHQ con BHA y BHT, Máx: 200 mg/kg (200 ppm).
7. Tocoferoles naturales o sintéticos (en concentración que no exceda la necesaria para el
efecto deseado).
8. Palmitato y estearato de ascorbilo, Máx: 200 mg/kg (200 ppm), aislados o mezclados.
9. Acido cítrico, ácido fosfórico, citrato de monoisopropilo, ésteres de monoglicéridos con ácido
cítrico, Máx: 100 mg/kg (100 ppm), aislados o mezclados.
El máximo señalado para los compuestos comprendidos en el Inc 9 será el mismo cuando se
usen solos (si el aceite posee suficientes antioxidantes naturales) o en mezclas sinérgicas con
los antioxidantes citados en los Inc 1 a 8"".",0.9999999999666667,1.0,0.0,0.0,Basic
¿Qué antioxidantes o sinergistas pueden agregarse a los aceites y grasas vegetales comestibles?,"['Antioxidantes y sinergistas autorizados que pueden agregarse a los aceites y grasas vegetales comestibles incluyen ácido sórbico, ácido benzoico y sus sales en cantidades no superiores a 1 g/kg (1000 ppm) expresados como ácidos, según lo establecido en el Artículo 523 bis del reglamento mencionado.', 'ANT: antioxidante', 'Los antioxidantes o sinergistas que pueden agregarse a los aceites y grasas vegetales comestibles, excluyendo los aceites de oliva de presión no refinados, son los siguientes:\n1. Galato de propilo, galato de octilo y galato de dodecilo (o sus mezclas) hasta un máximo de 100 mg/kg.\n2. Hidroxianisol butilado (BHA) hasta un máximo de 200 mg/kg.\n3. Hidroxitolueno butilado (BHT) hasta un máximo de 200 mg/kg.\n4. Terbutilhidroquinona (TBHQ) hasta un máximo de 200 mg/kg.']","Los antioxidantes o sinergistas que pueden agregarse a los aceites y grasas vegetales comestibles, excluyendo los aceites de oliva de presión no refinados, son los siguientes:

1. Galato de propilo, galato de octilo y galato de dodecilo (o sus mezclas) hasta un máximo de 100 mg/kg.
2. Hidroxianisol butilado (BHA) hasta un máximo de 200 mg/kg.
3. Hidroxitolueno butilado (BHT) hasta un máximo de 200 mg/kg.
4. Terbutilhidroquinona (TBHQ) hasta un máximo de 200 mg/kg.

Además, se pueden agregar ácido sórbico, ácido benzoico y sus sales en cantidades no superiores a 1 g/kg (1000 ppm) expresados como ácidos, según lo establecido en el Artículo 523 bis del reglamento correspondiente.","Artículo 523bis - (Res 2012, 19.10.84)
""Los aceites y grasas vegetales comestibles podrán ser adicionados, con la exclusión de los
aceites de oliva de presión no refinados, de los siguientes antioxidantes y sinergistas:
1. Galato de propilo, galato de octilo y galato de dodecilo (o sus mezclas), Máx: 100 mg/kg
(100 ppm), aislados o mezclados.
2. Hidroxianisol butilado (BHA), Máx: 200 mg/kg (200 ppm).
3. Hidroxitolueno butilado (BHT), Máx: 200 mg/kg (200 ppm)
4. Terbutilhidroquinona (TBHQ), Máx: 200 mg/kg (200 ppm).
5. Mezcla de los galatos citados, BHA y/o BHT, Máx: 200 mg/kg (200 ppm) siempre que no
incorporen más de 100 mg/kg (100 ppm) de galatos.
6. Mezclas de TBHQ con BHA y BHT, Máx: 200 mg/kg (200 ppm).
7. Tocoferoles naturales o sintéticos (en concentración que no exceda la necesaria para el
efecto deseado).
8. Palmitato y estearato de ascorbilo, Máx: 200 mg/kg (200 ppm), aislados o mezclados.
9. Acido cítrico, ácido fosfórico, citrato de monoisopropilo, ésteres de monoglicéridos con ácido
cítrico, Máx: 100 mg/kg (100 ppm), aislados o mezclados.
El máximo señalado para los compuestos comprendidos en el Inc 9 será el mismo cuando se
usen solos (si el aceite posee suficientes antioxidantes naturales) o en mezclas sinérgicas con
los antioxidantes citados en los Inc 1 a 8"".",0.9999999999666667,1.0,0.8940167832664248,0.9166666666666666,Advanced
